profile_id,age,gender,accent,scenario_id,file,duration,sentence,label,intensity
CLD_014_PT,young,female,Sulista,RL0_1,CLD_014_PT_RL0_1.wav,4.7339375,"Você voltou, meu Deus! Eu tava tão perdida sem você aqui em casa, vem cá!",happy,5
CLD_014_PT,young,female,Sulista,RL12_6,CLD_014_PT_RL12_6.wav,5.1983125,"Não acredito que consegui, valeu cada noite mal dormida estudando pra isso!",happy,5
CLD_014_PT,young,female,Sulista,RL17_7,CLD_014_PT_RL17_7.wav,3.9444375,"Ufa, peguei em cima da hora, mais um minutinho e tinha perdido!",relieved,4
CLD_014_PT,young,female,Sulista,RL1_2,CLD_014_PT_RL1_2.wav,5.24475,"Pronto, mandei o pedido e tirei esse peso das costas, não aguentava mais aquilo!",relieved,4
CLD_014_PT,young,female,Sulista,RL1_3,CLD_014_PT_RL1_3.wav,6.2664375,"Ufa, ainda bem que era só um susto, achei que ia me dar dor de cabeça o resto da semana!",relieved,4
CLD_014_PT,young,female,Sulista,RL22_8,CLD_014_PT_RL22_8.wav,2.6905625,"Caiu do céu na hora certa, que coisa boa!",happy,4
CLD_014_PT,young,female,Sulista,RL27_9,CLD_014_PT_RL27_9.wav,4.08375,"Não tô pronta pra largar tudo isso, parece que foi tudo tão rápido.",sad,4
CLD_014_PT,young,female,Sulista,RL7_4,CLD_014_PT_RL7_4.wav,5.337625,"Ai, finalmente em casa! Só quero tirar esse sapato e jogar na cama agora.",relieved,4
CLD_014_PT,young,female,Sulista,RL7_5,CLD_014_PT_RL7_5.wav,4.362375,"Graças a Deus foi só um sonho, meu coração ainda tá disparado.",relieved,4
CLD_014_PT,young,female,Sulista,SH0_10,CLD_014_PT_SH0_10.wav,5.709125,Ele me acompanhou a vida inteira... como é que eu vou pra casa agora e ele não vai tá lá me esperando?,sad,5
CLD_014_PT,young,female,Sulista,SH19_12,CLD_014_PT_SH19_12.wav,4.548125,"Espera, você tá falando sério? A gente tava tão bem ontem, o que mudou?",sad,4
CLD_014_PT,young,female,Sulista,SH28_13,CLD_014_PT_SH28_13.wav,7.659625,"Ai, meu amor, vem cá, deixa eu ficar do teu lado... não gosto nem um pouco de te ver assim.",sad,4
CLD_014_PT,young,female,Sulista,SH31_14,CLD_014_PT_SH31_14.wav,5.1983125,"Ah, não... eu tava tão ansiosa pra esse final de semana, agora não vai ter mais nada?",sad,4
CLD_014_PT,young,female,Sulista,SH35_15,CLD_014_PT_SH35_15.wav,5.3840625,"Caramba, vai ser tão estranho acordar sem ouvir a voz deles do meu lado todo dia...",sad,4
CLD_014_PT,young,female,Sulista,SH9_11,CLD_014_PT_SH9_11.wav,3.7586875,Não tô conseguindo acreditar que não vou poder mais ouvir a voz dela...,sad,5
CLD_014_PT,young,female,Sulista,SL18_4,CLD_014_PT_SL18_4.wav,6.1735625,"Doía deixar pra trás cada cantinho dessa casa, mas eu não tinha mais como bancar o aluguel.",sad,4
CLD_014_PT,young,female,Sulista,SL1_1,CLD_014_PT_SL1_1.wav,5.61625,"Como assim me mandaram embora? Eu dei o meu melhor lá, não consigo nem entender o que aconteceu.",sad,4
CLD_014_PT,young,female,Sulista,SL23_5,CLD_014_PT_SL23_5.wav,4.4088125,"Tu nem me escutou direito, parece que o que eu sinto não importa pra ninguém.",sad,4
CLD_014_PT,young,female,Sulista,SL23_6,CLD_014_PT_SL23_6.wav,3.990875,"Sério mesmo que tu vai sair assim, sem nem me olhar na cara?",sad,4
CLD_014_PT,young,female,Sulista,SL25_7,CLD_014_PT_SL25_7.wav,5.4769375,"Ai, não acredito que perdi ele... era o meu favorito, procurei em todo lugar e nada.",sad,4
CLD_014_PT,young,female,Sulista,SL39_8,CLD_014_PT_SL39_8.wav,4.3159375,Sério que vocês foram sem mim? Eu nem fiquei sabendo que ia ter rolê...,sad,3
CLD_014_PT,young,female,Sulista,SL45_9,CLD_014_PT_SL45_9.wav,7.3345625,"Como assim você fez isso comigo? Eu confiei em você, e você foi capaz de me olhar na cara todo esse tempo fingindo que tava tudo bem?",angry,5
CLD_014_PT,young,female,Sulista,SL6_2,CLD_014_PT_SL6_2.wav,4.641,"Treinei tanto pra isso, fiquei sem chão quando vi que meu nome não tava na lista.",sad,4
CLD_014_PT,young,female,Sulista,SL7_3,CLD_014_PT_SL7_3.wav,5.4769375,"Ah, não... era só o que me faltava, justo agora que eu tava morrendo de fome.",sad,4
CLD_016_PT,middle-age,male,Nordestino,AH20_8,CLD_016_PT_AH20_8.wav,6.684375,"Não, agora não, logo no meio do caminho! E eu já tava atrasado pra caramba.",angry,4
CLD_016_PT,middle-age,male,Nordestino,AH20_9,CLD_016_PT_AH20_9.wav,5.151875,"Rapaz, você não olhou não? Bateu bem na traseira do meu carro, presta atenção!",angry,5
CLD_016_PT,middle-age,male,Nordestino,AH23_10,CLD_016_PT_AH23_10.wav,5.4769375,"Logo você, meu velho... eu confiava em cada palavra que saía da sua boca.",sad,4
CLD_016_PT,middle-age,male,Nordestino,AH23_11,CLD_016_PT_AH23_11.wav,4.2230625,"Pô, eu também tô aqui na conversa, ou minha opinião não vale nada pra vocês?",angry,3
CLD_016_PT,middle-age,male,Nordestino,AH26_12,CLD_016_PT_AH26_12.wav,4.2230625,"Calma lá, eu não tive nada a ver com isso, tá me confundindo com outra pessoa.",angry,4
CLD_016_PT,middle-age,male,Nordestino,AH33_13,CLD_016_PT_AH33_13.wav,3.5265,"Para com isso, você nem tá ouvindo o que eu falo, só quer ter razão na marra.",angry,4
CLD_016_PT,middle-age,male,Nordestino,AH41_14,CLD_016_PT_AH41_14.wav,3.4335625,"Ô meu filho, assim não se fala com os outros não, viu?",neutral,2
CLD_016_PT,middle-age,male,Nordestino,AH44_15,CLD_016_PT_AH44_15.wav,3.898,"Pô, já é mais de meia-noite, será que dá pra abaixar um pouco essa zoeira?",angry,3
CLD_016_PT,middle-age,male,Nordestino,AL0_1,CLD_016_PT_AL0_1.wav,3.805125,"Larga isso agora, menino! Vai tomar um choque desse jeito!",angry,4
CLD_016_PT,middle-age,male,Nordestino,AL17_5,CLD_016_PT_AL17_5.wav,6.312875,"Esse carro não anda há uns dez minutos, e eu já tô atrasado pra reunião!",angry,4
CLD_016_PT,middle-age,male,Nordestino,AL17_6,CLD_016_PT_AL17_6.wav,4.780375,"Ô meu amigo, a fila começa lá atrás, viu? Aqui todo mundo tá esperando faz tempo.",angry,4
CLD_016_PT,middle-age,male,Nordestino,AL1_2,CLD_016_PT_AL1_2.wav,6.77725,De novo a mesma coisa? Agora sou eu que tenho que correr atrás pra consertar a sua bagunça.,angry,4
CLD_016_PT,middle-age,male,Nordestino,AL1_3,CLD_016_PT_AL1_3.wav,7.19525,"Peraí, esse projeto fui eu que fiz do começo ao fim, e agora você chega ali na frente do chefe como se a ideia tivesse saído da sua cabeça?",angry,4
CLD_016_PT,middle-age,male,Nordestino,AL42_7,CLD_016_PT_AL42_7.wav,4.2695,"Rapaz, me deixa terminar de falar pelo menos uma vez, pelo amor de Deus!",angry,4
CLD_016_PT,middle-age,male,Nordestino,AL6_4,CLD_016_PT_AL6_4.wav,4.5016875,"Gente, presta atenção no mapa, a gente tá se entregando de graça desse jeito!",angry,4
CLD_016_PT,middle-age,male,Nordestino,JH15_9,CLD_016_PT_JH15_9.wav,7.381,"Meu filho chegou, gente! Olha que coisa mais linda, nem acredito que ele tá aqui nos meus braços.",happy,5
CLD_016_PT,middle-age,male,Nordestino,JH16_10,CLD_016_PT_JH16_10.wav,4.9196875,"Que ar puro, rapaz! Faz tempo que eu não respirava uma paz dessas.",happy,4
CLD_016_PT,middle-age,male,Nordestino,JH16_11,CLD_016_PT_JH16_11.wav,4.87325,"Olha só essa cidade, cada esquina é uma surpresa! Tô doido pra conhecer tudo aqui.",happy,4
CLD_016_PT,middle-age,male,Nordestino,JH29_12,CLD_016_PT_JH29_12.wav,6.4521875,"Disse sim! A gente vai construir uma vida juntos, mal posso acreditar que isso tá acontecendo de verdade.",happy,5
CLD_016_PT,middle-age,male,Nordestino,JH32_13,CLD_016_PT_JH32_13.wav,8.6813125,"Meu Deus, finalmente! Deixa eu te abraçar, faz tanto tempo que eu esperava por esse momento.",happy,5
CLD_016_PT,middle-age,male,Nordestino,JH42_14,CLD_016_PT_JH42_14.wav,6.1735625,"Rapaz, ele tocou justo a música que eu mais queria ouvir, eu não tô acreditando que tô vendo isso ao vivo!",happy,5
CLD_016_PT,middle-age,male,Nordestino,JH46_15,CLD_016_PT_JH46_15.wav,5.337625,"Pôxa, você lembrou justo disso que eu vivia comentando... nem sei o que dizer, ficou perfeito!",happy,4
CLD_016_PT,middle-age,male,Nordestino,JH6_7,CLD_016_PT_JH6_7.wav,7.3345625,"Eita, eu nunca ganho nada e logo hoje meu nome saiu no sorteio, não tô acreditando!",happy,5
CLD_016_PT,middle-age,male,Nordestino,JH6_8,CLD_016_PT_JH6_8.wav,4.780375,"Rapaz, jogamos demais hoje, essa vitória foi merecida demais!",happy,5
CLD_016_PT,middle-age,male,Nordestino,JL0_1,CLD_016_PT_JL0_1.wav,4.641,"Olha só esse danadinho farejando tudo, acho que ele já se sentiu em casa!",happy,4
CLD_016_PT,middle-age,male,Nordestino,JL11_4,CLD_016_PT_JL11_4.wav,6.6379375,"Rapaz, valeu cada noite estudando! Tirei a maior nota da turma, nem acreditei quando vi.",happy,5
CLD_016_PT,middle-age,male,Nordestino,JL20_5,CLD_016_PT_JL20_5.wav,6.684375,"Olha só ele aí na garagem, brilhando! Trabalhei demais pra esse momento, e agora é meu de verdade.",happy,5
CLD_016_PT,middle-age,male,Nordestino,JL39_6,CLD_016_PT_JL39_6.wav,4.966125,"Rapaz, faz tempo que a gente não se juntava assim, que saudade boa de rir com vocês!",happy,4
CLD_016_PT,middle-age,male,Nordestino,JL7_2,CLD_016_PT_JL7_2.wav,5.709125,"Rapaz, faz tempo que eu não comia uma comida tão boa, e ainda por cima na companhia de vocês!",happy,4
CLD_016_PT,middle-age,male,Nordestino,JL9_3,CLD_016_PT_JL9_3.wav,6.870125,"Lembra daquela tarde no quintal da vó, a gente rindo à toa até o sol se pôr? Não sai da minha cabeça.",happy,4
CLD_016_PT,middle-age,male,Nordestino,NH17_4,CLD_016_PT_NH17_4.wav,19.8733125,"Vou de carro mesmo, mas pego um trânsito danado naquela avenida principal. Saio de casa uns quarenta minutos antes só pra garantir, porque se atrasar um pouquinho já fica tudo travado. Tem dia que ligo o rádio, escuto umas notícias pra passar o tempo. No caminho de volta é que costuma ser pior, todo mundo querendo chegar em casa de uma vez.",neutral,2
CLD_016_PT,middle-age,male,Nordestino,NH24_5,CLD_016_PT_NH24_5.wav,17.4584375,"Ó, comprei arroz, feijão, um pouco de carne pra semana. Peguei também umas frutas que estavam num precinho bom, banana e mamão. Ah, e quase esqueci o café, que lá em casa não pode faltar de jeito nenhum. Faltou só o pão, mas esse eu pego na padaria mesmo.",neutral,2
CLD_016_PT,middle-age,male,Nordestino,NH48_6,CLD_016_PT_NH48_6.wav,20.407375,"Daqui da janela dá pra ver aquele pé de mangueira lá no quintal do vizinho, todo carregado. De manhã cedo vem um bando de passarinho cantar nos galhos, é uma beleza. Mais pra frente tem a rua de paralelepípedo e o pessoal passando pro trabalho. Bem ali no fim ainda dá pra avistar um pedacinho do morro, verdinho depois que choveu.",happy,3
CLD_016_PT,middle-age,male,Nordestino,NH6_3,CLD_016_PT_NH6_3.wav,17.412,"Rapaz, acordo cedo demais, lá pelas cinco e meia. Primeira coisa é tomar meu café bem forte, sem isso não funciono direito. Depois dou uma molhada nas plantas do quintal antes do sol esquentar, e aí sim começo a me arrumar pro trabalho. Gosto de fazer tudo com calma, sem pressa nenhuma.",neutral,2
CLD_016_PT,middle-age,male,Nordestino,NL1_1,CLD_016_PT_NL1_1.wav,16.6689375,"Rapaz, na segunda tem aquela reunião de equipe que não acaba nunca. Quarta eu tenho a consulta com o cardiologista, que faço questão de não furar. E ainda tem o futebol com a turma na quinta à noite, sagrado, viu? O resto da semana eu vou tocando conforme aparece.",neutral,2
CLD_016_PT,middle-age,male,Nordestino,NL21_2,CLD_016_PT_NL21_2.wav,16.529625,"Acabei de fechar um relatório sobre os custos do trimestre, sabe? Foi uma trabalheira só, porque os números não batiam de jeito nenhum no começo. Passei uns dois dias revisando planilha por planilha até achar onde tava o erro. No fim deu tudo certo e entreguei dentro do prazo, ainda bem.",neutral,2
CLD_016_PT,middle-age,male,Nordestino,RH11_11,CLD_016_PT_RH11_11.wav,5.802,"Rapaz, passei?! Eu tava certo que tinha ido mal, não acredito que consegui!",happy,5
CLD_016_PT,middle-age,male,Nordestino,RH18_12,CLD_016_PT_RH18_12.wav,6.22,"Aprovado, é?! Agora é só pegar a chave e começar a vida nova naquele cantinho, menino!",happy,5
CLD_016_PT,middle-age,male,Nordestino,RH21_13,CLD_016_PT_RH21_13.wav,4.2695,"Ufa, consegui mandar bem em cima da hora! Quase que essa não dava certo.",relieved,4
CLD_016_PT,middle-age,male,Nordestino,RH25_14,CLD_016_PT_RH25_14.wav,4.2230625,"Ah, graças a Deus, tava bem aqui no bolso o tempo todo!",relieved,4
CLD_016_PT,middle-age,male,Nordestino,RH2_10,CLD_016_PT_RH2_10.wav,6.40575,"Graças a Deus, deu tudo limpo... eu nem sei o que dizer, tirou um peso enorme do meu peito.",relieved,5
CLD_016_PT,middle-age,male,Nordestino,RH49_15,CLD_016_PT_RH49_15.wav,5.8949375,"Que bom, fico tão tranquilo de saber que tá se recuperando bem, já tava com o coração apertado!",relieved,4
CLD_016_PT,middle-age,male,Nordestino,RL0_1,CLD_016_PT_RL0_1.wav,5.5698125,"Meu Deus, voltou! Eu já tinha procurado em tudo quanto era canto, vem cá, vem!",relieved,5
CLD_016_PT,middle-age,male,Nordestino,RL12_6,CLD_016_PT_RL12_6.wav,5.4305,"Rapaz, consegui! Todo aquele esforço valeu a pena, agora é comemorar!",happy,5
CLD_016_PT,middle-age,male,Nordestino,RL17_7,CLD_016_PT_RL17_7.wav,5.151875,"Ufa, cheguei em cima da hora, mais um minutinho e tinha perdido!",relieved,3
CLD_016_PT,middle-age,male,Nordestino,RL1_2,CLD_016_PT_RL1_2.wav,3.7586875,"Pronto, tirei esse peso das costas! Agora respiro de novo.",relieved,4
CLD_016_PT,middle-age,male,Nordestino,RL1_3,CLD_016_PT_RL1_3.wav,5.059,"Rapaz, eu já tava me preparando pro pior, mas não deu em nada!",relieved,4
CLD_016_PT,middle-age,male,Nordestino,RL22_8,CLD_016_PT_RL22_8.wav,5.4769375,"Rapaz, caiu do céu! Era bem isso que eu tava precisando pra fechar as contas.",happy,4
CLD_016_PT,middle-age,male,Nordestino,RL27_9,CLD_016_PT_RL27_9.wav,7.288125,"Pois é, hoje fecha esse ciclo... vou sentir saudade de chegar aqui todo dia e ver essa turma toda junta.",sad,4
CLD_016_PT,middle-age,male,Nordestino,RL7_4,CLD_016_PT_RL7_4.wav,5.6626875,"Ah, finalmente em casa... agora é só largar tudo e sentar nesse sofá.",relieved,4
CLD_016_PT,middle-age,male,Nordestino,RL7_5,CLD_016_PT_RL7_5.wav,5.337625,"Ufa, era só sonho... graças a Deus, meu coração tá quase saindo pela boca.",relieved,4
CLD_016_PT,middle-age,male,Nordestino,SH0_10,CLD_016_PT_SH0_10.wav,5.8484375,"Aquele cachorro me acompanhou a infância inteira, não consigo nem imaginar a casa sem ele.",sad,4
CLD_016_PT,middle-age,male,Nordestino,SH19_12,CLD_016_PT_SH19_12.wav,5.24475,"Mas como assim acabou? A gente tava tão bem, eu nem entendo o que mudou de uma hora pra outra.",sad,4
CLD_016_PT,middle-age,male,Nordestino,SH28_13,CLD_016_PT_SH28_13.wav,5.5698125,"Meu Deus, que que tá acontecendo com você? Me dá o braço aqui, deixa eu te ajudar a sentar.",sad,4
CLD_016_PT,middle-age,male,Nordestino,SH31_14,CLD_016_PT_SH31_14.wav,5.337625,"Ah, não... eu tava contando os dias pra isso, rapaz. Que decepção.",sad,4
CLD_016_PT,middle-age,male,Nordestino,SH35_15,CLD_016_PT_SH35_15.wav,6.0806875,Essa casa tá tão vazia... daria tudo pra ouvir a zoeira deles aqui agora.,sad,4
CLD_016_PT,middle-age,male,Nordestino,SH9_11,CLD_016_PT_SH9_11.wav,5.1983125,"Não tô acreditando que ela se foi, parece que faltou o chão debaixo dos meus pés.",sad,5
CLD_016_PT,middle-age,male,Nordestino,SL18_4,CLD_016_PT_SL18_4.wav,5.709125,"Vinte anos morando aqui, e agora tenho que deixar tudo pra trás... custa demais aceitar isso.",sad,4
CLD_016_PT,middle-age,male,Nordestino,SL1_1,CLD_016_PT_SL1_1.wav,6.1735625,"Como assim me mandaram embora? Depois de tudo que eu fiz por essa empresa, é assim que me agradecem...",sad,4
CLD_016_PT,middle-age,male,Nordestino,SL23_5,CLD_016_PT_SL23_5.wav,6.684375,Eu abri meu coração pra você e você simplesmente fingiu que não era nada... doeu mais do que eu imaginava.,sad,4
CLD_016_PT,middle-age,male,Nordestino,SL23_6,CLD_016_PT_SL23_6.wav,4.1301875,"Depois de tudo que a gente passou, você simplesmente me dá as costas e vai embora?",sad,4
CLD_016_PT,middle-age,male,Nordestino,SL25_7,CLD_016_PT_SL25_7.wav,4.8268125,Procurei na casa toda e nada... era a única coisa que eu guardava do meu pai.,sad,4
CLD_016_PT,middle-age,male,Nordestino,SL39_8,CLD_016_PT_SL39_8.wav,5.5698125,"Poxa, eu tava aqui esperando notícia e fico sabendo que vocês foram sem mim...",sad,3
CLD_016_PT,middle-age,male,Nordestino,SL45_9,CLD_016_PT_SL45_9.wav,4.966125,"Como você foi capaz de fazer isso comigo, depois de tudo que a gente construiu junto?",sad,5
CLD_016_PT,middle-age,male,Nordestino,SL6_2,CLD_016_PT_SL6_2.wav,5.9878125,Treinei feito doido esses meses todos pra ficar de fora bem na hora? Não tem cabimento isso.,sad,4
CLD_016_PT,middle-age,male,Nordestino,SL7_3,CLD_016_PT_SL7_3.wav,6.0806875,"Ah, não... logo agora que eu tava morto de fome, foi tudo pro chão.",sad,4
CLD_018_PT,middle-age,male,Mineiro,AH20_8,CLD_018_PT_AH20_8.wav,5.337625,"Ah, não, logo agora? Parou tudo do nada, nem sinal deu antes.",angry,4
CLD_018_PT,middle-age,male,Mineiro,AH20_9,CLD_018_PT_AH20_9.wav,4.3159375,"Ô rapaz, você não viu que eu tava passando? Bateu bem na lateral!",angry,4
CLD_018_PT,middle-age,male,Mineiro,AH23_10,CLD_018_PT_AH23_10.wav,5.9878125,"Logo você, cara... eu botava a mão no fogo, e me veio com essa história?",sad,4
CLD_018_PT,middle-age,male,Mineiro,AH23_11,CLD_018_PT_AH23_11.wav,4.362375,"Ué, então eu falei pra parede? Pelo menos finge que tá me ouvindo.",angry,3
CLD_018_PT,middle-age,male,Mineiro,AH26_12,CLD_018_PT_AH26_12.wav,5.6626875,"Calma lá, eu nem tava perto disso, como é que você me joga essa culpa assim?",angry,4
CLD_018_PT,middle-age,male,Mineiro,AH33_13,CLD_018_PT_AH33_13.wav,5.523375,"Para, escuta um minuto, do jeito que você tá falando não tem como a gente chegar em lugar nenhum.",angry,4
CLD_018_PT,middle-age,male,Mineiro,AH41_14,CLD_018_PT_AH41_14.wav,4.8268125,"Ô meu bem, assim não dá, com a tia a gente conversa com mais educação, tá?",neutral,2
CLD_018_PT,middle-age,male,Mineiro,AH44_15,CLD_018_PT_AH44_15.wav,6.312875,"Uai, será que dá pra abaixar esse som? Já são quase duas da manhã, ô.",angry,3
CLD_018_PT,middle-age,male,Mineiro,AL0_1,CLD_018_PT_AL0_1.wav,5.1983125,"Larga isso, ô bicho! Você vai acabar tomando um choque desse jeito!",angry,4
CLD_018_PT,middle-age,male,Mineiro,AL17_5,CLD_018_PT_AL17_5.wav,5.337625,"Ô meu Deus, num anda nem um palmo... e eu já tô atrasado pra reunião.",angry,3
CLD_018_PT,middle-age,male,Mineiro,AL17_6,CLD_018_PT_AL17_6.wav,5.709125,"Ô amigo, a fila começa lá atrás, viu? Aqui todo mundo tá esperando faz tempo.",angry,3
CLD_018_PT,middle-age,male,Mineiro,AL1_2,CLD_018_PT_AL1_2.wav,5.6626875,De novo a mesma coisa? Agora sobrou pra mim arrumar a bagunça que você fez!,angry,4
CLD_018_PT,middle-age,male,Mineiro,AL1_3,CLD_018_PT_AL1_3.wav,7.381,"Espera aí, esse projeto fui eu que fiz do começo ao fim, e você vai lá receber os parabéns na minha frente?",angry,4
CLD_018_PT,middle-age,male,Mineiro,AL42_7,CLD_018_PT_AL42_7.wav,5.337625,"Me deixa terminar de falar, ué, toda hora você me corta no meio.",angry,3
CLD_018_PT,middle-age,male,Mineiro,AL6_4,CLD_018_PT_AL6_4.wav,6.870125,"Gente, presta atenção no mapa, a gente tá levando de lavada e ninguém cobre ninguém!",angry,4
CLD_018_PT,middle-age,male,Mineiro,JH15_9,CLD_018_PT_JH15_9.wav,6.7308125,"Ele chegou, gente! Olha que coisinha mais perfeita, nem acredito que é meu filho!",happy,5
CLD_018_PT,middle-age,male,Mineiro,JH16_10,CLD_018_PT_JH16_10.wav,5.9878125,"Que paz que dá ficar aqui ó, escutando esse passarinho, sentindo esse cheiro de mato molhado.",happy,3
CLD_018_PT,middle-age,male,Mineiro,JH16_11,CLD_018_PT_JH16_11.wav,5.523375,"Uai, olha só esse lugar, nunca imaginei que ia conhecer um canto desses na minha vida!",happy,4
CLD_018_PT,middle-age,male,Mineiro,JH29_12,CLD_018_PT_JH29_12.wav,6.7308125,"Gente, eu tô casado! Ainda não caiu a ficha que agora é pra vida toda, viu?",happy,5
CLD_018_PT,middle-age,male,Mineiro,JH32_13,CLD_018_PT_JH32_13.wav,5.24475,"Cê não tem ideia da saudade que eu tava de você, vem cá, deixa eu te abraçar!",happy,5
CLD_018_PT,middle-age,male,Mineiro,JH42_14,CLD_018_PT_JH42_14.wav,6.312875,"Cara, esperei tanto tempo por esse momento, ele tá tocando bem na minha frente!",happy,5
CLD_018_PT,middle-age,male,Mineiro,JH46_15,CLD_018_PT_JH46_15.wav,6.9165625,"Uai, que coisa mais linda, você não precisava... mas eu adorei demais!",happy,4
CLD_018_PT,middle-age,male,Mineiro,JH6_7,CLD_018_PT_JH6_7.wav,7.102375,"Uai, eu nunca ganho nada na vida e agora vai logo isso? Mal posso acreditar!",happy,5
CLD_018_PT,middle-age,male,Mineiro,JH6_8,CLD_018_PT_JH6_8.wav,4.87325,"Conseguimos, rapaziada! Esse jogo a gente vai lembrar por muito tempo!",happy,5
CLD_018_PT,middle-age,male,Mineiro,JL0_1,CLD_018_PT_JL0_1.wav,4.87325,"Olha só pra esse danadinho cheirando tudo, já tá se achando o dono da casa, sô.",happy,4
CLD_018_PT,middle-age,male,Mineiro,JL11_4,CLD_018_PT_JL11_4.wav,5.9878125,"Rapaz, valeu a pena ter virado a noite estudando, tirei a maior nota da turma!",happy,4
CLD_018_PT,middle-age,male,Mineiro,JL20_5,CLD_018_PT_JL20_5.wav,8.72775,"Agora é meu, comprei com meu próprio suor! Mal posso esperar pra dar a primeira voltinha por aí.",happy,5
CLD_018_PT,middle-age,male,Mineiro,JL39_6,CLD_018_PT_JL39_6.wav,7.2416875,"Rapaz, que bom rever essa turma toda junta de novo, faz um tempão que a gente não se encontrava assim!",happy,4
CLD_018_PT,middle-age,male,Mineiro,JL7_2,CLD_018_PT_JL7_2.wav,7.6131875,"Nossa, faz tempo que eu não comia uma comida tão boa assim, ainda mais com todo mundo reunido na mesma mesa.",happy,4
CLD_018_PT,middle-age,male,Mineiro,JL9_3,CLD_018_PT_JL9_3.wav,7.7525,"Olha, eu lembro até hoje daquele dia que a gente ficou sentado na varanda conversando até de madrugada, parece que foi ontem.",happy,4
CLD_018_PT,middle-age,male,Mineiro,NH17_4,CLD_018_PT_NH17_4.wav,20.407375,"Pego o carro e vou pegando aquela estrada de sempre, uns vinte minutos se o trânsito colaborar. Tem dia que é tranquilo, tem dia que travа tudo logo na entrada da cidade. Aproveito e ligo o rádio, escuto uma notícia, fico por dentro do que tá rolando. Quando chego, estaciono no mesmo cantinho de sempre e já caio direto no batente.",neutral,2
CLD_018_PT,middle-age,male,Mineiro,NH24_5,CLD_018_PT_NH24_5.wav,19.54825,"Ah, fui ali rápido só pegar o básico mesmo. Levei arroz, um feijãozinho, café, e aquele pão de queijo congelado que minha esposa gosta. Peguei umas frutas também, banana e mamão pro café da manhã. Acabei trazendo um chocolate na hora de pagar, sabe como é, fica ali na fila te chamando.",neutral,2
CLD_018_PT,middle-age,male,Mineiro,NH48_6,CLD_018_PT_NH48_6.wav,20.6395625,"Daqui de cima dá pra ver aquele pé de manga lá no fundo do quintal do vizinho, tá carregadinho esse ano. Mais pra longe tem um morro verdinho que de manhã fica todo coberto de neblina, uma beleza. Passarinho não falta, vivem cantando no fio de luz bem na frente. Gosto de ficar aqui tomando meu cafezinho só olhando esse movimento.",happy,3
CLD_018_PT,middle-age,male,Mineiro,NH6_3,CLD_018_PT_NH6_3.wav,23.19375,"Acordo cedo, antes do despertador tocar na maioria das vezes. Primeira coisa é botar o café pra passar, sem isso nem penso direito. Aí dou uma olhada no celular enquanto a água esquenta, vejo as mensagens que chegaram de madrugada. Tomo o café com calma na cozinha, ouvindo o movimento da rua começar lá fora. Depois disso já vou me arrumar pra encarar o dia.",neutral,2
CLD_018_PT,middle-age,male,Mineiro,NL1_1,CLD_018_PT_NL1_1.wav,16.6225,"Olha, segunda tem reunião de equipe logo cedo, que sempre se arrasta. Quarta eu tenho a aula de violão, que faço questão de não perder. E na sexta normalmente fecho a semana com o pessoal pra acertar as contas. Fora isso, é meio corrido, mas dá pra levar.",neutral,2
CLD_018_PT,middle-age,male,Mineiro,NL21_2,CLD_018_PT_NL21_2.wav,19.3160625,"Ah, terminei umas planilhas de fechamento do mês passado, nada que dê muito orgulho de contar. Foi mais juntar número, conferir, ver se batia tudo certinho. Tomou um tempo danado, viu, mas ficou redondo no fim. Agora tô só esperando o pessoal dar o aval pra fechar de vez.",neutral,2
CLD_018_PT,middle-age,male,Mineiro,RH11_11,CLD_018_PT_RH11_11.wav,4.0373125,"Uai, passei mesmo? Achei que ia ter que fazer tudo de novo!",happy,4
CLD_018_PT,middle-age,male,Mineiro,RH18_12,CLD_018_PT_RH18_12.wav,5.9878125,"Agora é nossa, gente! Já tô vendo a gente arrumando aquele quintal pra fazer um churrasco!",happy,5
CLD_018_PT,middle-age,male,Mineiro,RH21_13,CLD_018_PT_RH21_13.wav,3.898,"Ufa, consegui! Foi por pouco, mas tá entregue.",relieved,4
CLD_018_PT,middle-age,male,Mineiro,RH25_14,CLD_018_PT_RH25_14.wav,4.1301875,"Graças a Deus, tava aqui no fundo da gaveta o tempo todo!",relieved,4
CLD_018_PT,middle-age,male,Mineiro,RH2_10,CLD_018_PT_RH2_10.wav,4.8268125,"Graças a Deus, tirei um peso enorme das costas, nem sei o que dizer agora.",relieved,5
CLD_018_PT,middle-age,male,Mineiro,RH49_15,CLD_018_PT_RH49_15.wav,5.9878125,"Ah, que bom saber que ele já tá melhorando, tirou um peso enorme das minhas costas!",relieved,4
CLD_018_PT,middle-age,male,Mineiro,RL0_1,CLD_018_PT_RL0_1.wav,6.684375,"Ô bichinho danado, achei que não ia mais te ver, vem cá que eu tava com o coração na mão!",relieved,5
CLD_018_PT,middle-age,male,Mineiro,RL12_6,CLD_018_PT_RL12_6.wav,7.659625,"Consegui, uai! Tanto esforço e agora deu certo, nem acredito que é minha vez de comemorar!",happy,5
CLD_018_PT,middle-age,male,Mineiro,RL17_7,CLD_018_PT_RL17_7.wav,4.6875,"Ufa, cheguei bem em cima da hora, mais um minutinho e tinha perdido.",relieved,3
CLD_018_PT,middle-age,male,Mineiro,RL1_2,CLD_018_PT_RL1_2.wav,6.2664375,"Pronto, entreguei a carta hoje de manhã, e cê não imagina o peso que saiu das minhas costas.",relieved,4
CLD_018_PT,middle-age,male,Mineiro,RL1_3,CLD_018_PT_RL1_3.wav,5.337625,"Graças a Deus, eu jurava que tava tudo perdido, mas no fim não era nada disso.",relieved,4
CLD_018_PT,middle-age,male,Mineiro,RL22_8,CLD_018_PT_RL22_8.wav,5.1983125,"Nossa, caiu do céu mesmo, eu tava precisando demais disso bem agora.",relieved,4
