profile_id,age,gender,accent,scenario_id,file,duration,sentence,label,intensity
GMA_004_PT,young,male,Mineiro,NH24_5,GMA_004_PT_NH24_5.wav,8.35625,"Ah, caramba, foi só o básico de sempre mesmo. Comprei mais uns ovos, umas batatas pra esquentar e uns tomates. A gente tá precisando de uns temperos pra fazer janta esse fim de semana.",neutral,2
GMA_004_PT,young,male,Mineiro,NH48_6,GMA_004_PT_NH48_6.wav,8.4026875,"Nossa, que paisagem boa, viu. Tá vendo como a luz bate aqui? É uma coisa linda. Aquele verde lá longe parece que não acaba nunca, dá uma acalmada só de olhar, sério.",neutral,3
GMA_004_PT,young,male,Mineiro,NH6_3,GMA_004_PT_NH6_3.wav,10.864,"Cara, a rotina é meio caótica, pra ser sincero. Acordar é sempre uma luta, né? Só consigo levantar depois de passar um tempo pra só dar uma sacudida no corpo. Depois disso, é correr pro café que é o combustível pra gente começar o dia.",neutral,2
GMA_004_PT,young,male,Mineiro,NL1_1,GMA_004_PT_NL1_1.wav,9.377875,"Nossa, pra contar direito, nem sei. Acho que tá sempre alguma coisa rolando. De manhã tem as aulas, e depois eu fico de saco cheio de reunião até tarde. É uma rotina meio maluca, viu?",neutral,3
GMA_004_PT,young,male,Mineiro,NL21_2,GMA_004_PT_NL21_2.wav,10.4924375,"Ah, mano, eu acabei de finalizar uma pesquisa sobre arquitetura moderna na região. Demorou pra juntar todas as referências, juro que achei muito material. Mas achei o tema fascinante, viu? Saí de um jeito que gostei mesmo.",neutral,3
GMA_004_PT,young,male,Mineiro,RH11_11,GMA_004_PT_RH11_11.wav,3.201375,Poxa vida! Achei que tinha sido o fim. Tô aliviadíssimo!,relieved,5
GMA_004_PT,young,male,Mineiro,RH18_12,GMA_004_PT_RH18_12.wav,5.523375,"Caramba, sério mesmo? Isso não é possível! Agora sim, a gente vai começar a vida nova.",relieved,5
GMA_004_PT,young,male,Mineiro,RH21_13,GMA_004_PT_RH21_13.wav,2.2725625,"Ufa, tá feito! Pelo amor de Deus, por fim.",relieved,4
GMA_004_PT,young,male,Mineiro,RH25_14,GMA_004_PT_RH25_14.wav,1.576,"Meu Deus, onde tava isso?",relieved,4
GMA_004_PT,young,male,Mineiro,RH2_10,GMA_004_PT_RH2_10.wav,2.5976875,"Não acredito, é mesmo? Então tá tudo certo mesmo?",relieved,4
GMA_004_PT,young,male,Mineiro,RH49_15,GMA_004_PT_RH49_15.wav,2.7834375,"Caramba, achei que não ia dar certo, viu? Melhor que eu imaginava mesmo.",relieved,4
GMA_004_PT,young,male,Mineiro,RL0_1,GMA_004_PT_RL0_1.wav,1.76175,Não acredito... Ele voltou mesmo.,relieved,5
GMA_004_PT,young,male,Mineiro,RL12_6,GMA_004_PT_RL12_6.wav,3.1085,"Não acredito que deu certo de verdade! Eu tô muito feliz, cara.",happy,4
GMA_004_PT,young,male,Mineiro,RL17_7,GMA_004_PT_RL17_7.wav,1.9475,"Ufa, que bom que eu cheguei na hora certa!",relieved,4
GMA_004_PT,young,male,Mineiro,RL1_2,GMA_004_PT_RL1_2.wav,3.0620625,"Puxa vida, que paz. Finalmente tô livre desse sufoco todo.",relieved,4
GMA_004_PT,young,male,Mineiro,RL1_3,GMA_004_PT_RL1_3.wav,2.829875,"Caramba, achei que ia ter um pepino sério aqui. Que alívio!",relieved,4
GMA_004_PT,young,male,Mineiro,RL22_8,GMA_004_PT_RL22_8.wav,1.7153125,Não acredito que isso aqui é de verdade.,relieved,4
GMA_004_PT,young,male,Mineiro,RL27_9,GMA_004_PT_RL27_9.wav,2.1796875,"Pô, que loucura! Como é que o tempo voou, sô.",happy,4
GMA_004_PT,young,male,Mineiro,RL7_4,GMA_004_PT_RL7_4.wav,3.1085,"Poxa, finalmente. Juro que eu tava pedindo pra chegar em qualquer lugar.",relieved,4
GMA_004_PT,young,male,Mineiro,RL7_5,GMA_004_PT_RL7_5.wav,2.829875,"Meu Deus, que susto! Achei que tinha acontecido mesmo.",relieved,4
GMA_004_PT,young,male,Mineiro,SH0_10,GMA_004_PT_SH0_10.wav,2.737,Ele era tão parte da gente. Como é que ele foi embora?,sad,4
GMA_004_PT,young,male,Mineiro,SH19_12,GMA_004_PT_SH19_12.wav,2.2725625,"É, mas como assim? A gente estava tudo certo, né?",sad,4
GMA_004_PT,young,male,Mineiro,SH28_13,GMA_004_PT_SH28_13.wav,1.9475,"Meu Deus, você tá bem de verdade?",sad,4
GMA_004_PT,young,male,Mineiro,SH31_14,GMA_004_PT_SH31_14.wav,1.9010625,"Que decepção, sério? Poxa vida.",sad,4
GMA_004_PT,young,male,Mineiro,SH35_15,GMA_004_PT_SH35_15.wav,3.48,"Nossa, essa distância tá pesada demais. Vou sentir muito a falta de vocês.",sad,4
GMA_004_PT,young,male,Mineiro,SH9_11,GMA_004_PT_SH9_11.wav,2.3190625,"Não, não pode ser sério. Como assim ele?",sad,5
GMA_004_PT,young,male,Mineiro,SL18_4,GMA_004_PT_SL18_4.wav,3.0620625,"É um sufoco, viu? Mudar de casa com tanta pressa assim...",sad,3
GMA_004_PT,young,male,Mineiro,SL1_1,GMA_004_PT_SL1_1.wav,1.9010625,"É, entendi. Foi rápido mesmo, né?",sad,4
GMA_004_PT,young,male,Mineiro,SL23_5,GMA_004_PT_SL23_5.wav,2.226125,Jura que você não percebeu que isso me incomodou tanto?,sad,4
GMA_004_PT,young,male,Mineiro,SL23_6,GMA_004_PT_SL23_6.wav,2.6905625,"Ô, espera aí. Por que você tá virando as costas pra mim?",angry,4
GMA_004_PT,young,male,Mineiro,SL25_7,GMA_004_PT_SL25_7.wav,3.387125,"Caramba, não pode ter sumido. Eu tava com ele aqui, juro.",angry,4
GMA_004_PT,young,male,Mineiro,SL39_8,GMA_004_PT_SL39_8.wav,3.3406875,"Achei que a gente ia fazer alguma coisa junto. Deixar de fora assim, viu?",sad,4
GMA_004_PT,young,male,Mineiro,SL45_9,GMA_004_PT_SL45_9.wav,3.2478125,"Você tá me zoando, né? Me fala que não é verdade o que eu tô vendo aqui.",angry,5
GMA_004_PT,young,male,Mineiro,SL6_2,GMA_004_PT_SL6_2.wav,2.55125,Mas espera aí... Achei que ia dar certo pra gente.,sad,4
GMA_004_PT,young,male,Mineiro,SL7_3,GMA_004_PT_SL7_3.wav,3.6658125,Poxa... Já era. Não consigo nem pegar de novo agora.,sad,4
GMA_005_PT,young,male,Fluminense,AH20_8,GMA_005_PT_AH20_8.wav,5.4769375,"Poxa vida, de repente? Mas que deu nisso? Não pode ser agora.",angry,4
GMA_005_PT,young,male,Fluminense,AH20_9,GMA_005_PT_AH20_9.wav,4.2230625,"Mas que porra foi essa? Tá conseguindo dirigir direito, cara?",angry,4
GMA_005_PT,young,male,Fluminense,AH23_10,GMA_005_PT_AH23_10.wav,4.1301875,Então era isso? Eu realmente não sei o que pensar agora.,angry,4
GMA_005_PT,young,male,Fluminense,AH23_11,GMA_005_PT_AH23_11.wav,4.362375,"É, entendi. Não é assim que funciona, né?",angry,3
GMA_005_PT,young,male,Fluminense,AH26_12,GMA_005_PT_AH26_12.wav,3.7586875,Você tá zoando comigo? Eu não fiz nada disso!,angry,4
GMA_005_PT,young,male,Fluminense,AH33_13,GMA_005_PT_AH33_13.wav,3.1085,"Para de levar isso tão a sério, por favor.",angry,4
GMA_005_PT,young,male,Fluminense,AH41_14,GMA_005_PT_AH41_14.wav,3.29425,"Poxa vida... Que jeito é esse, hein?",angry,3
GMA_005_PT,young,male,Fluminense,AH44_15,GMA_005_PT_AH44_15.wav,4.0373125,"Mano, dá pra abaixar um pouco o som, por favor?",angry,3
GMA_005_PT,young,male,Fluminense,AL0_1,GMA_005_PT_AL0_1.wav,4.08375,"Ei, para com isso! Não morde os cabos assim, por favor!",angry,4
GMA_005_PT,young,male,Fluminense,AL17_5,GMA_005_PT_AL17_5.wav,3.5265,"Mas que horas são? Vai chegar quando, meu Deus?",angry,3
GMA_005_PT,young,male,Fluminense,AL17_6,GMA_005_PT_AL17_6.wav,4.2230625,"E aí, cara? Não pode fazer isso, foi furar a fila!",angry,4
GMA_005_PT,young,male,Fluminense,AL1_2,GMA_005_PT_AL1_2.wav,3.2478125,Sério mesmo? Isso vai dar problema pra gente.,angry,4
GMA_005_PT,young,male,Fluminense,AL1_3,GMA_005_PT_AL1_3.wav,5.059,"Mas espera aí, ele falou que foi ele que fez? Isso é absurdo.",angry,5
GMA_005_PT,young,male,Fluminense,AL42_7,GMA_005_PT_AL42_7.wav,6.22,"Cara, sério? Não dá pra deixar eu terminar o raciocínio? Você tá cortando tudo.",angry,3
GMA_005_PT,young,male,Fluminense,AL6_4,GMA_005_PT_AL6_4.wav,4.4088125,"Juro, não dá! Vocês precisam coordenar isso direito, caramba!",angry,4
GMA_005_PT,young,male,Fluminense,JH15_9,GMA_005_PT_JH15_9.wav,4.2230625,Meu Deus do céu... olha que maravilha.,happy,5
GMA_005_PT,young,male,Fluminense,JH16_10,GMA_005_PT_JH16_10.wav,4.6875,"Cara, que lugar incrível. Dá até vontade de parar o tempo aqui mesmo.",happy,3
GMA_005_PT,young,male,Fluminense,JH16_11,GMA_005_PT_JH16_11.wav,3.898,"Meu Deus, eu não acredito que a gente tá vendo isso.",happy,4
GMA_005_PT,young,male,Fluminense,JH29_12,GMA_005_PT_JH29_12.wav,5.709125,"Caramba, eu simplesmente não estou processando nada. Você tá maluco(a)?",happy,5
GMA_005_PT,young,male,Fluminense,JH32_13,GMA_005_PT_JH32_13.wav,3.990875,"Cara, é você! Não acredito que te vi de novo!",happy,5
GMA_005_PT,young,male,Fluminense,JH42_14,GMA_005_PT_JH42_14.wav,3.9444375,"Caraca, juro que esse refrão me pegou de jeito! Que show.",happy,5
GMA_005_PT,young,male,Fluminense,JH46_15,GMA_005_PT_JH46_15.wav,4.87325,"Poxa, você não precisava fazer isso! Me surpreendeu demais.",happy,4
GMA_005_PT,young,male,Fluminense,JH6_7,GMA_005_PT_JH6_7.wav,4.08375,"Pô, eu não acredito! De verdade, isso é pra mim?",happy,5
GMA_005_PT,young,male,Fluminense,JH6_8,GMA_005_PT_JH6_8.wav,4.6875,"Caraca, que partida! Nós merecemos demais esse resultado.",happy,5
GMA_005_PT,young,male,Fluminense,JL0_1,GMA_005_PT_JL0_1.wav,3.898,Não acredito que ele tá aqui. Tá lindo demais.,happy,4
GMA_005_PT,young,male,Fluminense,JL11_4,GMA_005_PT_JL11_4.wav,3.1549375,"Mano, tá brincando com a gente? Que nota!",happy,4
GMA_005_PT,young,male,Fluminense,JL20_5,GMA_005_PT_JL20_5.wav,4.548125,"Putz, valeu demais! Tô muito feliz com essa máquina aqui.",happy,4
GMA_005_PT,young,male,Fluminense,JL39_6,GMA_005_PT_JL39_6.wav,2.829875,"Cara, a vibe aqui tá muito boa hoje.",happy,3
GMA_005_PT,young,male,Fluminense,JL7_2,GMA_005_PT_JL7_2.wav,5.0125625,"Cara, sério que o prato tá bom demais? Que almoço sensacional.",happy,4
GMA_005_PT,young,male,Fluminense,JL9_3,GMA_005_PT_JL9_3.wav,5.337625,"Ah, que saudade desses tempos. Parece que foi ontem que a gente tava fazendo isso.",happy,4
GMA_005_PT,young,male,Fluminense,NH17_4,GMA_005_PT_NH17_4.wav,15.5544375,"Cara, dependendo do dia, é uma loucura. Tenho que enfrentar o metrô super cheio no pico, sabe? Parece que a gente tá amontoado numa lata de sardinha, de verdade. É muita gente, e ainda tenho que atravessar a rua com pressa.",neutral,3
GMA_005_PT,young,male,Fluminense,NH24_5,GMA_005_PT_NH24_5.wav,14.0683125,"Nossa, foi coisa de comer mesmo. Peguei umas frutas diferentes que eu não costumo comprar, sabe? E umas cervejas pra galera. A gente precisava repor um monte de coisa básica, mas deu pra dar uma boa variada.",neutral,2
GMA_005_PT,young,male,Fluminense,NH48_6,GMA_005_PT_NH48_6.wav,14.207625,"Mano, para tudo. Dá uma beleza impressionante o que tá rolando lá fora agora. Deve ter chovido de novo ou algo assim, porque o céu tá incrível, sabe? Deixa eu só ficar aqui um pouco pra aproveitar esse ângulo.",happy,3
GMA_005_PT,young,male,Fluminense,NH6_3,GMA_005_PT_NH6_3.wav,12.95375,"Cara, é uma batalha mesmo. Tipo, eu já tenho que apertar o botão de soneca umas cinco vezes, sabe? Acordar é um sufoco, mas depois já é correr pra tomar um café forte. Sem isso, não dá pra sair de casa.",neutral,3
GMA_005_PT,young,male,Fluminense,NL1_1,GMA_005_PT_NL1_1.wav,13.278875,"Ah, na real é tudo bem bagunçado mesmo. Tipo, só um monte de aula e uns compromisso aleatórios que aparecem. Não é nada fixo, sabe? Acho que semana que vem até vai mudar tudo de novo.",neutral,2
GMA_005_PT,young,male,Fluminense,NL21_2,GMA_005_PT_NL21_2.wav,15.600875,"Ah, tá ligado, foi uma loucura mesmo. Tive que montar um trabalho sobre [tema] que era mega detalhado. Demorei um tempão para conseguir juntar tudo e fazer a apresentação. Deu um sufoco, juro, mas pelo menos acabou.",neutral,3
GMA_005_PT,young,male,Fluminense,RH11_11,GMA_005_PT_RH11_11.wav,4.6875,"Caraca, eu passei? Juro que achei que tinha acabado.",relieved,4
GMA_005_PT,young,male,Fluminense,RH18_12,GMA_005_PT_RH18_12.wav,5.0125625,"Meu Deus, conseguimos mesmo! Não acredito, agora é pra casa.",happy,5
GMA_005_PT,young,male,Fluminense,RH21_13,GMA_005_PT_RH21_13.wav,3.7586875,"Ufa, por pouco. Achei que ia dar ruim aqui.",relieved,4
GMA_005_PT,young,male,Fluminense,RH25_14,GMA_005_PT_RH25_14.wav,3.71225,"Meu Deus, achou! Pensei mesmo que tinha sumido.",relieved,4
GMA_005_PT,young,male,Fluminense,RH2_10,GMA_005_PT_RH2_10.wav,4.2230625,"Que notícia boa! Meu Deus, eu ainda não tô processando isso.",relieved,5
GMA_005_PT,young,male,Fluminense,RH49_15,GMA_005_PT_RH49_15.wav,5.2911875,"Cara, sério? Tá indo muito bem demais. Fico tão tranquilo agora.",relieved,4
GMA_005_PT,young,male,Fluminense,RL0_1,GMA_005_PT_RL0_1.wav,4.45525,Meu Deus... Você tá aqui? Eu não acredito!,relieved,5
GMA_005_PT,young,male,Fluminense,RL12_6,GMA_005_PT_RL12_6.wav,3.619375,"Cara, não estou acreditando. Foi sério isso?",happy,5
GMA_005_PT,young,male,Fluminense,RL17_7,GMA_005_PT_RL17_7.wav,4.45525,"Ufa, que raios! Achei que tinha perdido essa conexão.",relieved,4
GMA_005_PT,young,male,Fluminense,RL1_2,GMA_005_PT_RL1_2.wav,3.5729375,"Caramba, que peso que saiu. Finalmente.",relieved,4
GMA_005_PT,young,male,Fluminense,RL1_3,GMA_005_PT_RL1_3.wav,3.5729375,"Nossa, achei que tinha passado o rolo. Que droga!",relieved,4
GMA_005_PT,young,male,Fluminense,RL22_8,GMA_005_PT_RL22_8.wav,4.0373125,Sério? Eu tava contando com esse dinheiro. Valeu demais!,happy,5
GMA_005_PT,young,male,Fluminense,RL27_9,GMA_005_PT_RL27_9.wav,6.77725,"Poxa, mal posso acreditar que já acabou. Foi um perrengue, mas valeu demais por tudo!",relieved,4
GMA_005_PT,young,male,Fluminense,RL7_4,GMA_005_PT_RL7_4.wav,4.548125,"Ah, finalmente! Tô exausto, mas que bom que cheguei.",relieved,4
GMA_005_PT,young,male,Fluminense,RL7_5,GMA_005_PT_RL7_5.wav,3.4335625,"Meu Deus, o que foi aquilo? Nem era real.",relieved,4
GMA_005_PT,young,male,Fluminense,SH0_10,GMA_005_PT_SH0_10.wav,4.966125,"Caramba... como foi tão rápido, cara? É inacreditável.",sad,4
GMA_005_PT,young,male,Fluminense,SH19_12,GMA_005_PT_SH19_12.wav,3.990875,É sério mesmo? Eu achei que a gente ia ficar junto.,sad,4
GMA_005_PT,young,male,Fluminense,SH28_13,GMA_005_PT_SH28_13.wav,5.6626875,"Caramba, mas o que aconteceu com você? Por favor, me fala que tá tudo bem.",angry,5
GMA_005_PT,young,male,Fluminense,SH31_14,GMA_005_PT_SH31_14.wav,3.5729375,Poxa vida! Estava contando demais com isso.,sad,4
GMA_005_PT,young,male,Fluminense,SH35_15,GMA_005_PT_SH35_15.wav,4.6875,"Que droga, cara. Vou sentir demais a falta de vocês.",sad,4
GMA_005_PT,young,male,Fluminense,SH9_11,GMA_005_PT_SH9_11.wav,5.151875,"Não... Não é possível, por favor. Você não pode ter ido.",sad,5
GMA_005_PT,young,male,Fluminense,SL18_4,GMA_005_PT_SL18_4.wav,3.201375,Será que a gente vai dar conta dessa mudança toda?,angry,4
GMA_005_PT,young,male,Fluminense,SL1_1,GMA_005_PT_SL1_1.wav,4.0373125,O que que foi isso? Eu não entendi absolutamente nada.,sad,4
GMA_005_PT,young,male,Fluminense,SL23_5,GMA_005_PT_SL23_5.wav,3.2478125,"""Sério? Eu achei que você ia entender o meu lado.""",sad,4
GMA_005_PT,young,male,Fluminense,SL23_6,GMA_005_PT_SL23_6.wav,2.3655,"E aí, qual é? Não ia falar nada, né?",sad,4
GMA_005_PT,young,male,Fluminense,SL25_7,GMA_005_PT_SL25_7.wav,4.0373125,"Não, não pode ser... Onde que eu deixei isso?",sad,4
GMA_005_PT,young,male,Fluminense,SL39_8,GMA_005_PT_SL39_8.wav,2.92275,"Nossa, achei que a gente ia sair junto.",sad,3
GMA_005_PT,young,male,Fluminense,SL45_9,GMA_005_PT_SL45_9.wav,4.0373125,"Você tá zoando comigo, né? Me fala que não foi de verdade.",angry,5
GMA_005_PT,young,male,Fluminense,SL6_2,GMA_005_PT_SL6_2.wav,4.2230625,É sério isso? Depois de tanto que a gente se dedicou?,sad,4
GMA_005_PT,young,male,Fluminense,SL7_3,GMA_005_PT_SL7_3.wav,3.898,"Nossa, juro que eu não consigo nem comer direito agora.",sad,3
GMA_006_PT,young,male,Paulista,AH20_8,GMA_006_PT_AH20_8.wav,4.7339375,"Caramba, que raios! Não tá andando, não dá pra nada.",angry,4
GMA_006_PT,young,male,Paulista,AH20_9,GMA_006_PT_AH20_9.wav,2.3655,O que foi isso? Você não viu nada?,angry,4
GMA_006_PT,young,male,Paulista,AH23_10,GMA_006_PT_AH23_10.wav,3.015625,Eu realmente achei que podia contar com você.,sad,4
GMA_006_PT,young,male,Paulista,AH23_11,GMA_006_PT_AH23_11.wav,4.780375,"Cara, por que você não tá prestando atenção no que eu tô falando?",angry,3
GMA_006_PT,young,male,Paulista,AH26_12,GMA_006_PT_AH26_12.wav,3.898,"Que acusação é essa? Você tá me enrolando, sacou?",angry,4
GMA_006_PT,young,male,Paulista,AH33_13,GMA_006_PT_AH33_13.wav,3.7586875,"Mas o que foi isso? Você não tá levando isso a sério, né?",angry,3
GMA_006_PT,young,male,Paulista,AH41_14,GMA_006_PT_AH41_14.wav,3.1085,Você estava falando sério comigo agora?,angry,3
GMA_006_PT,young,male,Paulista,AH44_15,GMA_006_PT_AH44_15.wav,5.059,Que horário é esse pra fazer barulho? Tá impossível eu dormir aqui.,angry,4
GMA_006_PT,young,male,Paulista,AL0_1,GMA_006_PT_AL0_1.wav,3.387125,"Ai, não! Para de morder isso, por favor!",angry,4
GMA_006_PT,young,male,Paulista,AL17_5,GMA_006_PT_AL17_5.wav,4.548125,"Juro, eu chego em casa quando? Isso aqui tá impossível.",angry,3
GMA_006_PT,young,male,Paulista,AL17_6,GMA_006_PT_AL17_6.wav,3.48,"Peraí, mas não pode passar na frente de ninguém assim, não.",angry,4
GMA_006_PT,young,male,Paulista,AL1_2,GMA_006_PT_AL1_2.wav,3.9444375,"Cara, não sei como a gente vai entregar isso se estiver assim.",angry,4
GMA_006_PT,young,male,Paulista,AL1_3,GMA_006_PT_AL1_3.wav,4.3159375,Como assim? Você não viu que esse material foi meu?,angry,4
GMA_006_PT,young,male,Paulista,AL42_7,GMA_006_PT_AL42_7.wav,3.1085,"Gente, sério? Não dá pra esperar um pouco?",angry,4
GMA_006_PT,young,male,Paulista,AL6_4,GMA_006_PT_AL6_4.wav,5.059,"Gente, não tá dando direito. A gente precisa se organizar melhor.",angry,4
GMA_006_PT,young,male,Paulista,JH15_9,GMA_006_PT_JH15_9.wav,4.45525,"Nossa, que coisa mais linda! Meu Deus do céu.",happy,5
GMA_006_PT,young,male,Paulista,JH16_10,GMA_006_PT_JH16_10.wav,4.2230625,"Caraca, que cor esse céu tá. Não dá pra acreditar, né?",happy,4
GMA_006_PT,young,male,Paulista,JH16_11,GMA_006_PT_JH16_11.wav,6.22,"Nossa, que parada boa. Não é o que eu esperava, mas tô amando esse clima.",happy,4
GMA_006_PT,young,male,Paulista,JH29_12,GMA_006_PT_JH29_12.wav,5.5698125,"Caramba! Sério? Que notícia maravilhosa, vocês merecem demais!",happy,5
GMA_006_PT,young,male,Paulista,JH32_13,GMA_006_PT_JH32_13.wav,5.059,"Meu Deus! Que surpresa boa! Faz tanto tempo, né?",happy,5
GMA_006_PT,young,male,Paulista,JH42_14,GMA_006_PT_JH42_14.wav,3.805125,"Mano, ele nunca decepciona, né? Que energia!",happy,5
GMA_006_PT,young,male,Paulista,JH46_15,GMA_006_PT_JH46_15.wav,3.9444375,"Nossa, que coisa linda! Sério que você pensou nisso?",happy,4
GMA_006_PT,young,male,Paulista,JH6_7,GMA_006_PT_JH6_7.wav,4.2695,"Não pode ser! Sério, gente? Cara, que sorte a minha!",happy,5
GMA_006_PT,young,male,Paulista,JH6_8,GMA_006_PT_JH6_8.wav,3.990875,"Juro, não achei que a gente ia conseguir! Que jogo, cara!",happy,4
GMA_006_PT,young,male,Paulista,JL0_1,GMA_006_PT_JL0_1.wav,4.4088125,"Putz, olha ele! Não acredito que ele se adaptou tão rápido.",happy,4
GMA_006_PT,young,male,Paulista,JL11_4,GMA_006_PT_JL11_4.wav,3.4335625,Que nota absurda! Eu não acredito que tirou isso.,happy,4
GMA_006_PT,young,male,Paulista,JL20_5,GMA_006_PT_JL20_5.wav,3.8515625,Não tô acreditando que é meu! Que maravilha.,happy,5
GMA_006_PT,young,male,Paulista,JL39_6,GMA_006_PT_JL39_6.wav,4.45525,"Gente, eu não sei o que tá pegando aqui, mas tá muito bom!",happy,4
GMA_006_PT,young,male,Paulista,JL7_2,GMA_006_PT_JL7_2.wav,4.6875,"Série mesmo, que delícia! Vocês sempre sabem o que fazer.",happy,4
GMA_006_PT,young,male,Paulista,JL9_3,GMA_006_PT_JL9_3.wav,5.6626875,"Nossa, que dia! Eu passei a sensação de que foi ontem que tudo aconteceu de novo.",happy,3
GMA_006_PT,young,male,Paulista,NH17_4,GMA_006_PT_NH17_4.wav,15.6473125,"Pelo amor de Deus, eu não aguento mais passar nesse metrô. Tipo, é uma briga só pra achar um pé, sabe? Se não tiver muita gente, parece que ninguém vive aqui. Aí o tempo passa voando, e ainda tem que correr pra não perder a aula.",neutral,3
GMA_006_PT,young,male,Paulista,NH24_5,GMA_006_PT_NH24_5.wav,14.021875,"Ah, nem sei. Comprei muita coisa mesmo. Fiz uma lista gigante, né? Pão, umas maçãs e aquele molho de tomate que eu adoro. Ah, e um pacote de café gourmet, achei que tava com promoção.",neutral,2
GMA_006_PT,young,male,Paulista,NH48_6,GMA_006_PT_NH48_6.wav,15.8330625,"Cara, essa vista é surreal, não tô acreditando. Parece que a cidade conseguiu encaixar uns jardins assim, meio fora de hora. Dá até uma paz olhar pro movimento, mas sem o barulho insuportável. É maneiro demais.",happy,3
GMA_006_PT,young,male,Paulista,NH6_3,GMA_006_PT_NH6_3.wav,18.665875,"Ah, sério? Minha manhã é meio caótica pra ser sincero. Eu costumo acordar meio grogue, sabe? Assim que levanto, a prioridade é tomar um café forte, sem falta. Senão, não consigo nem pensar direito em nada. Aí é só começar a me organizar pra encarar o dia.",neutral,3
GMA_006_PT,young,male,Paulista,NL1_1,GMA_006_PT_NL1_1.wav,11.6534375,"Ah, é uma rotina bem padrão mesmo, na verdade. Tenho umas aulas de manhã e depois é reunião na tarde. O pior é que as coisas sempre mudam, sabe? Nunca tem muita folga.",neutral,3
GMA_006_PT,young,male,Paulista,NL21_2,GMA_006_PT_NL21_2.wav,16.8083125,"Ah, na verdade foi algo bem denso. Eu tive que montar umas análises de dados pra um cliente, sabe? Foi meio pesado de processar tudo porque tinha muita variação numérica. Mas foi um desafio legal e eu acabei aprendendo a usar umas ferramentas novas.",neutral,3
GMA_006_PT,young,male,Paulista,RH11_11,GMA_006_PT_RH11_11.wav,4.5945625,"Poxa vida, de verdade? Eu achei que ia dar ruim mesmo.",relieved,5
GMA_006_PT,young,male,Paulista,RH18_12,GMA_006_PT_RH18_12.wav,4.0373125,"Que notícia incrível! Meu Deus, tá tudo certo, né?",relieved,5
GMA_006_PT,young,male,Paulista,RH21_13,GMA_006_PT_RH21_13.wav,4.2230625,"Ufa, acabou! Achei que não ia dar tempo mesmo.",relieved,4
GMA_006_PT,young,male,Paulista,RH25_14,GMA_006_PT_RH25_14.wav,3.387125,"Meu Deus, achei! Sério que tava aqui?",relieved,5
GMA_006_PT,young,male,Paulista,RH2_10,GMA_006_PT_RH2_10.wav,4.1301875,"Nossa, sério? Não tô sentindo. É verdade mesmo?",relieved,5
GMA_006_PT,young,male,Paulista,RH49_15,GMA_006_PT_RH49_15.wav,2.6905625,"Caramba, você tá melhor que eu imaginava.",relieved,4
GMA_006_PT,young,male,Paulista,RL0_1,GMA_006_PT_RL0_1.wav,5.059,Meu Deus! Ele tá aqui? Achei que tinha dado ruim de vez.,relieved,5
GMA_006_PT,young,male,Paulista,RL12_6,GMA_006_PT_RL12_6.wav,4.2230625,"Caraca, eu não tô acreditando. Juro que é de verdade?",happy,5
GMA_006_PT,young,male,Paulista,RL17_7,GMA_006_PT_RL17_7.wav,4.4088125,"Nossa, por pouco perdi. Ainda bem que deu tempo de embarcar!",relieved,4
GMA_006_PT,young,male,Paulista,RL1_2,GMA_006_PT_RL1_2.wav,4.08375,"Ufa, que coisa! Acabou o inferno, sério.",relieved,5
GMA_006_PT,young,male,Paulista,RL1_3,GMA_006_PT_RL1_3.wav,2.92275,"Caramba, eu achei mesmo que ia dar ruim.",relieved,4
GMA_006_PT,young,male,Paulista,RL22_8,GMA_006_PT_RL22_8.wav,4.6875,"Caramba, eu tava quase nessa. Me ajuda muito de verdade.",relieved,4
GMA_006_PT,young,male,Paulista,RL27_9,GMA_006_PT_RL27_9.wav,4.6875,É muito estranho pensar que foi isso mesmo. O tempo voou.,sad,4
GMA_006_PT,young,male,Paulista,RL7_4,GMA_006_PT_RL7_4.wav,3.990875,"Nossa, que paz. Tá um sossego aqui em casa.",relieved,4
GMA_006_PT,young,male,Paulista,RL7_5,GMA_006_PT_RL7_5.wav,3.898,"Caraca, eu achei que tava acontecendo! Que susto.",relieved,4
GMA_006_PT,young,male,Paulista,SH0_10,GMA_006_PT_SH0_10.wav,3.2478125,Meu Deus... eu não consigo acreditar nisso.,sad,5
GMA_006_PT,young,male,Paulista,SH19_12,GMA_006_PT_SH19_12.wav,2.3655,Então é isso mesmo? Acabou?,sad,4
GMA_006_PT,young,male,Paulista,SH28_13,GMA_006_PT_SH28_13.wav,4.1301875,"Nossa, você tá bem? Me diz que não tá doendo muito, tá?",angry,4
GMA_006_PT,young,male,Paulista,SH31_14,GMA_006_PT_SH31_14.wav,3.898,"Não pode ser. A gente ia muito, sério mesmo?",sad,4
GMA_006_PT,young,male,Paulista,SH35_15,GMA_006_PT_SH35_15.wav,3.898,"Vou sentir tanta falta de tudo, de vocês.",sad,4
GMA_006_PT,young,male,Paulista,SH9_11,GMA_006_PT_SH9_11.wav,2.5048125,Não... como foi possível?,sad,5
GMA_006_PT,young,male,Paulista,SL18_4,GMA_006_PT_SL18_4.wav,4.3159375,"Poxa, mas de novo? Como a gente vai se virar dessa vez?",sad,4
GMA_006_PT,young,male,Paulista,SL1_1,GMA_006_PT_SL1_1.wav,3.8515625,O quê? Mas por quê? Eu tava fazendo tudo certo aqui.,sad,4
GMA_006_PT,young,male,Paulista,SL23_5,GMA_006_PT_SL23_5.wav,3.1549375,"Tipo, eu pensei que a gente tava numa boa.",sad,4
GMA_006_PT,young,male,Paulista,SL23_6,GMA_006_PT_SL23_6.wav,2.92275,"Mas que foi isso? Sem dar um sinal, é?",sad,3
GMA_006_PT,young,male,Paulista,SL25_7,GMA_006_PT_SL25_7.wav,3.9444375,"Não, para tudo. Por favor, me diz que eu não perdi ele.",angry,4
GMA_006_PT,young,male,Paulista,SL39_8,GMA_006_PT_SL39_8.wav,2.7834375,"Ah, sério? Não chamaram eu?",sad,4
GMA_006_PT,young,male,Paulista,SL45_9,GMA_006_PT_SL45_9.wav,3.71225,Não acredito que é você. Você tá falando sério?,angry,5
GMA_006_PT,young,male,Paulista,SL6_2,GMA_006_PT_SL6_2.wav,4.6875,"Mas espera aí, vocês estão falando sério? Eu achei que ia rolar.",sad,4
GMA_006_PT,young,male,Paulista,SL7_3,GMA_006_PT_SL7_3.wav,3.619375,"Ai, não acredito. De novo, que desastre!",angry,4
GMA_007_PT,young,male,Sulista,AH20_8,GMA_007_PT_AH20_8.wav,3.619375,"Caraca, mas o que foi isso? Eu tô ferrado aqui.",angry,4
GMA_007_PT,young,male,Sulista,AH20_9,GMA_007_PT_AH20_9.wav,4.2230625,"E aí? O que que aconteceu aqui, cara? Dá uma ver se tá tudo certo.",angry,4
GMA_007_PT,young,male,Sulista,AH23_10,GMA_007_PT_AH23_10.wav,3.201375,Sério? Não achei que você faria isso comigo.,sad,4
GMA_007_PT,young,male,Sulista,AH23_11,GMA_007_PT_AH23_11.wav,3.898,Mas é muito fácil você simplesmente ignorar o que eu falo.,angry,4
GMA_007_PT,young,male,Sulista,AH26_12,GMA_007_PT_AH26_12.wav,4.2695,Com que base você tá falando isso? Não tem explicação nenhuma pra isso.,angry,4
