profile_id,age,gender,accent,scenario_id,file,duration,sentence,label,intensity
GPT_002_PT,young,male,Nordestino,RL1_3,GPT_002_PT_RL1_3.wav,1.5295625,"Eita, era só alarme falso.",relieved,4
GPT_002_PT,young,male,Nordestino,RL22_8,GPT_002_PT_RL22_8.wav,3.2478125,"Veio na hora certa, era o que faltava pra fechar as contas.",relieved,4
GPT_002_PT,young,male,Nordestino,RL27_9,GPT_002_PT_RL27_9.wav,3.2478125,"Acabou de verdade... valeu, turma.",sad,3
GPT_002_PT,young,male,Nordestino,RL7_4,GPT_002_PT_RL7_4.wav,1.3438125,"Até que enfim, meu canto.",relieved,3
GPT_002_PT,young,male,Nordestino,RL7_5,GPT_002_PT_RL7_5.wav,1.9939375,"Nossa, ainda bem que foi só um pesadelo.",relieved,4
GPT_002_PT,young,male,Nordestino,SH0_10,GPT_002_PT_SH0_10.wav,1.9939375,"Não acredito, meu bichinho se foi.",sad,4
GPT_002_PT,young,male,Nordestino,SH19_12,GPT_002_PT_SH19_12.wav,3.6658125,Sério que acabou assim? Eu ainda queria tentar.,sad,4
GPT_002_PT,young,male,Nordestino,SH28_13,GPT_002_PT_SH28_13.wav,1.9939375,Me dá tua mão; tô aqui contigo.,sad,4
GPT_002_PT,young,male,Nordestino,SH31_14,GPT_002_PT_SH31_14.wav,3.387125,Sério que cancelaram? Eu já tinha me programado pra isso.,angry,3
GPT_002_PT,young,male,Nordestino,SH35_15,GPT_002_PT_SH35_15.wav,4.2230625,Essa distância tá grande demais. Queria dar um pulo aí agora.,sad,4
GPT_002_PT,young,male,Nordestino,SH9_11,GPT_002_PT_SH9_11.wav,2.92275,"Não podia ser hoje. Volta pra mim, por favor.",sad,5
GPT_002_PT,young,male,Nordestino,SL18_4,GPT_002_PT_SL18_4.wav,3.4335625,Tô encaixotando metade da vida por causa de conta atrasada.,sad,4
GPT_002_PT,young,male,Nordestino,SL1_1,GPT_002_PT_SL1_1.wav,2.2725625,"Me mandaram embora mesmo, assim de supetão?",sad,4
GPT_002_PT,young,male,Nordestino,SL23_5,GPT_002_PT_SL23_5.wav,3.48,"Achei que você ia me ouvir de verdade, mas me deixou falando sozinho.",sad,4
GPT_002_PT,young,male,Nordestino,SL23_6,GPT_002_PT_SL23_6.wav,2.458375,Sério que tu virou as costas pra mim agora?,angry,4
GPT_002_PT,young,male,Nordestino,SL25_7,GPT_002_PT_SL25_7.wav,2.2725625,"Eita, cadê meu cordão? Eu tinha deixado aqui.",sad,4
GPT_002_PT,young,male,Nordestino,SL39_8,GPT_002_PT_SL39_8.wav,2.7834375,"Rapaz, sério que rolou e nem me avisaram?",sad,3
GPT_002_PT,young,male,Nordestino,SL45_9,GPT_002_PT_SL45_9.wav,2.1796875,Tu me traiu mesmo? Acabou.,angry,5
GPT_002_PT,young,male,Nordestino,SL6_2,GPT_002_PT_SL6_2.wav,2.226125,"Poxa, fiquei de fora depois de treinar tanto?",sad,3
GPT_002_PT,young,male,Nordestino,SL7_3,GPT_002_PT_SL7_3.wav,2.3190625,"Ah não, minha janta no chão bem agora.",angry,4
GPT_005_PT,young,male,Fluminense,AH20_8,GPT_005_PT_AH20_8.wav,5.0125625,"Pô, logo agora o carro resolve apagar? Sacanagem.",angry,4
GPT_005_PT,young,male,Fluminense,AH20_9,GPT_005_PT_AH20_9.wav,3.387125,"Qual é, cara?! Você entrou na minha faixa!",angry,4
GPT_005_PT,young,male,Fluminense,AH23_10,GPT_005_PT_AH23_10.wav,2.737,"Pô, logo você mentindo pra mim?",sad,3
GPT_005_PT,young,male,Fluminense,AH23_11,GPT_005_PT_AH23_11.wav,5.523375,"Qual é, alguém vai ouvir o que eu falei ou era só de enfeite?",angry,4
GPT_005_PT,young,male,Fluminense,AH26_12,GPT_005_PT_AH26_12.wav,4.0373125,"Pera aí, tão botando isso na minha conta? Eu nem tava lá.",angry,4
GPT_005_PT,young,male,Fluminense,AH33_13,GPT_005_PT_AH33_13.wav,4.2695,Não dá pra conversar assim; você tá distorcendo tudo.,angry,4
GPT_005_PT,young,male,Fluminense,AH41_14,GPT_005_PT_AH41_14.wav,2.1796875,"Pera aí, fala direitinho comigo.",angry,2
GPT_005_PT,young,male,Fluminense,AH44_15,GPT_005_PT_AH44_15.wav,3.1085,Dá pra segurar o barulho? Quero dormir.,angry,4
GPT_005_PT,young,male,Fluminense,AL0_1,GPT_005_PT_AL0_1.wav,3.4335625,"Ei, larga esse fio agora, vai dar ruim!",angry,4
GPT_005_PT,young,male,Fluminense,AL17_5,GPT_005_PT_AL17_5.wav,3.5265,"Travou geral, nem um palmo pra frente.",angry,4
GPT_005_PT,young,male,Fluminense,AL17_6,GPT_005_PT_AL17_6.wav,2.829875,"Ô, a fila começa lá atrás, tá?",angry,4
GPT_005_PT,young,male,Fluminense,AL1_2,GPT_005_PT_AL1_2.wav,4.7339375,"Pô, tá saindo um monte de erro aqui; confere direito e corrige, por favor.",angry,4
GPT_005_PT,young,male,Fluminense,AL1_3,GPT_005_PT_AL1_3.wav,3.71225,Como assim você levou o mérito? Fui eu que fiz isso.,angry,4
GPT_005_PT,young,male,Fluminense,AL42_7,GPT_005_PT_AL42_7.wav,2.2725625,"Calma aí, deixa eu terminar de falar.",angry,4
GPT_005_PT,young,male,Fluminense,AL6_4,GPT_005_PT_AL6_4.wav,4.9196875,"Pô, pressiona junto e fecha as laterais. Sozinho aqui não dá.",angry,4
GPT_005_PT,young,male,Fluminense,JH15_9,GPT_005_PT_JH15_9.wav,2.3655,"Caraca, chegou nosso bebê!",happy,5
GPT_005_PT,young,male,Fluminense,JH16_10,GPT_005_PT_JH16_10.wav,4.548125,"Pô, olha essa vista; dá até pra esquecer do resto.",relieved,3
GPT_005_PT,young,male,Fluminense,JH16_11,GPT_005_PT_JH16_11.wav,4.45525,Mal pisei e já tô perdido de tanta coisa pra ver.,happy,4
GPT_005_PT,young,male,Fluminense,JH29_12,GPT_005_PT_JH29_12.wav,3.4335625,Assinamos e tá valendo: casamos.,happy,5
GPT_005_PT,young,male,Fluminense,JH32_13,GPT_005_PT_JH32_13.wav,3.48,"Vem cá, me dá um abraço — demorou demais.",happy,4
GPT_005_PT,young,male,Fluminense,JH42_14,GPT_005_PT_JH42_14.wav,3.29425,"Caraca, essa ao vivo é outra história!",happy,4
GPT_005_PT,young,male,Fluminense,JH46_15,GPT_005_PT_JH46_15.wav,3.4335625,"Que surpresa boa, você acertou em cheio.",happy,4
GPT_005_PT,young,male,Fluminense,JH6_7,GPT_005_PT_JH6_7.wav,1.9475,"Caraca, saiu pra mim!",happy,4
GPT_005_PT,young,male,Fluminense,JH6_8,GPT_005_PT_JH6_8.wav,3.6658125,"Que vitória, time! Jogaram muito!",happy,5
GPT_005_PT,young,male,Fluminense,JL0_1,GPT_005_PT_JL0_1.wav,3.2478125,"Caraca, olha ele explorando tudo já!",happy,4
GPT_005_PT,young,male,Fluminense,JL11_4,GPT_005_PT_JL11_4.wav,1.9010625,"Caraca, tirei dez!",happy,5
GPT_005_PT,young,male,Fluminense,JL20_5,GPT_005_PT_JL20_5.wav,4.0373125,"Olha ele aí, meu primeiro carro — bora dar uma volta.",happy,4
GPT_005_PT,young,male,Fluminense,JL39_6,GPT_005_PT_JL39_6.wav,3.5265,Esse som tá perfeito; pega duas bebidas pra gente?,happy,3
GPT_005_PT,young,male,Fluminense,JL7_2,GPT_005_PT_JL7_2.wav,3.7586875,"Ficou sensacional, salva essa receita aí.",happy,4
GPT_005_PT,young,male,Fluminense,JL9_3,GPT_005_PT_JL9_3.wav,6.5915,"Pô, lembrar da gente naquele rolê me dá um sorrisão na hora. Vamos repetir qualquer dia?",happy,4
GPT_005_PT,young,male,Fluminense,NH17_4,GPT_005_PT_NH17_4.wav,18.2479375,"Saio de casa e pego o metrô na Estácio, faço a baldeação rapidinho e desço perto do trabalho. Quando o trem atrasa, vou de VLT a partir da Central pra não perder hora. No final, caminho uns dez minutos porque o trânsito ali trava demais pra ônibus.",neutral,2
GPT_005_PT,young,male,Fluminense,NH24_5,GPT_005_PT_NH24_5.wav,13.929,"Comprei pão, requeijão e café. Levei banana, alface e tomate pra semana. Aproveitei a promoção do frango e do arroz. E trouxe papel higiênico também, já tava no fim.",neutral,2
GPT_005_PT,young,male,Fluminense,NH48_6,GPT_005_PT_NH48_6.wav,23.6349375,"O céu tá meio alaranjado agora, batendo nos prédios e deixando as janelas brilhando. Dá pra ver o mar lá no fundo, com uns barquinhos parados, quase sem onda. Na rua, o bar da esquina já acendeu a placa e tem gente passando de bicicleta. O vento mexe nas copas das árvores e traz aquele cheirinho de chuva vindo de longe.",happy,2
GPT_005_PT,young,male,Fluminense,NH6_3,GPT_005_PT_NH6_3.wav,21.777375,"O despertador toca, eu deixo mais cinco minutinhos e levanto de vez. Vou direto beber um copão d'água e abrir a janela pra entrar luz. Preparo um café passado enquanto dou uma olhada rápida nas mensagens. Faço um alongamento curto e parto pro banho pra acordar o resto do corpo.",neutral,2
GPT_005_PT,young,male,Fluminense,NL1_1,GPT_005_PT_NL1_1.wav,18.108625,"Segunda cedo tem reunião de alinhamento com o time, sempre às nove. Terça e quinta faço aula de inglês à noite. Quarta rola o treino de futebol com a galera do trabalho. Sexta deixo reservado pra terapia e pra fechar as pendências.",neutral,2
GPT_005_PT,young,male,Fluminense,NL21_2,GPT_005_PT_NL21_2.wav,21.8934375,"Acabei de terminar uma análise de churn dos últimos três meses. Cruzei dados de suporte, uso de recursos e faturamento pra identificar padrões. Montei um dashboard no Looker com os segmentos mais críticos e duas hipóteses de teste. Agora tô esperando o ok do time de produto pra rodar um experimento com push segmentado.",neutral,2
GPT_005_PT,young,male,Fluminense,RH11_11,GPT_005_PT_RH11_11.wav,3.6658125,"Caraca, passei mesmo; tinha certeza que ia rodar.",relieved,4
GPT_005_PT,young,male,Fluminense,RH18_12,GPT_005_PT_RH18_12.wav,4.0373125,Aprovaram o financiamento da casa; agora vai.,happy,4
GPT_005_PT,young,male,Fluminense,RH21_13,GPT_005_PT_RH21_13.wav,2.737,Deu tempo certinho; tá entregue.,relieved,3
GPT_005_PT,young,male,Fluminense,RH25_14,GPT_005_PT_RH25_14.wav,3.2478125,"Caraca, meu celular aqui dentro da mochila.",relieved,4
GPT_005_PT,young,male,Fluminense,RH2_10,GPT_005_PT_RH2_10.wav,2.55125,"Pô, deu negativo. Obrigado mesmo.",relieved,4
GPT_005_PT,young,male,Fluminense,RH49_15,GPT_005_PT_RH49_15.wav,3.201375,"Que alívio, tá se recuperando direitinho.",relieved,4
GPT_005_PT,young,male,Fluminense,RL0_1,GPT_005_PT_RL0_1.wav,4.9196875,"Caraca, você voltou! Vem cá, nunca mais me dá esse susto.",relieved,5
GPT_005_PT,young,male,Fluminense,RL12_6,GPT_005_PT_RL12_6.wav,3.1085,Consegui! Valeu cada esforço.,happy,4
GPT_005_PT,young,male,Fluminense,RL17_7,GPT_005_PT_RL17_7.wav,2.2725625,"Por um triz, deu tempo.",relieved,3
GPT_005_PT,young,male,Fluminense,RL1_2,GPT_005_PT_RL1_2.wav,3.1085,Pedi demissão; não valia o desgaste.,relieved,4
GPT_005_PT,young,male,Fluminense,RL1_3,GPT_005_PT_RL1_3.wav,2.5976875,"Ufa, era só um susto.",relieved,4
GPT_005_PT,young,male,Fluminense,RL22_8,GPT_005_PT_RL22_8.wav,3.2478125,"Veio um PIX do nada, fechou minhas contas.",relieved,4
GPT_005_PT,young,male,Fluminense,RL27_9,GPT_005_PT_RL27_9.wav,4.4088125,"Última chamada, galera: assina minha camisa antes da saída.",happy,4
GPT_005_PT,young,male,Fluminense,RL7_4,GPT_005_PT_RL7_4.wav,4.08375,Até que enfim em casa. Quero um banho e silêncio.,relieved,3
GPT_005_PT,young,male,Fluminense,RL7_5,GPT_005_PT_RL7_5.wav,2.92275,"Pô, ainda bem que foi só sonho.",relieved,3
GPT_005_PT,young,male,Fluminense,SH0_10,GPT_005_PT_SH0_10.wav,4.08375,"Pô, meu companheiro de infância se foi, valeu por tudo.",sad,5
GPT_005_PT,young,male,Fluminense,SH19_12,GPT_005_PT_SH19_12.wav,2.829875,Sério que acabou assim? Do nada?,sad,4
GPT_005_PT,young,male,Fluminense,SH28_13,GPT_005_PT_SH28_13.wav,3.2478125,"Pô, você tá muito abatido; vamos pro hospital agora.",sad,4
GPT_005_PT,young,male,Fluminense,SH31_14,GPT_005_PT_SH31_14.wav,4.362375,"Caraca, cancelaram mesmo? Eu já tinha tudo certo.",angry,4
GPT_005_PT,young,male,Fluminense,SH35_15,GPT_005_PT_SH35_15.wav,3.387125,Abri as caixas e não tem ninguém pra rir comigo.,sad,3
GPT_005_PT,young,male,Fluminense,SH9_11,GPT_005_PT_SH9_11.wav,5.1983125,Não acredito que você não tá mais aqui; como eu faço sem você?,sad,5
GPT_005_PT,young,male,Fluminense,SL18_4,GPT_005_PT_SL18_4.wav,4.08375,Não deu pra segurar o aluguel; amanhã entrego a chave.,sad,4
GPT_005_PT,young,male,Fluminense,SL1_1,GPT_005_PT_SL1_1.wav,4.548125,"Caraca, do nada? Tá, me diz como fica a rescisão.",angry,3
GPT_005_PT,young,male,Fluminense,SL23_5,GPT_005_PT_SL23_5.wav,3.1085,"Pô, falei sério e você levou na brincadeira.",sad,3
GPT_005_PT,young,male,Fluminense,SL23_6,GPT_005_PT_SL23_6.wav,2.92275,"Virou as costas pra mim, é isso?",sad,4
GPT_005_PT,young,male,Fluminense,SL25_7,GPT_005_PT_SL25_7.wav,4.641,"Ah, não... cadê meu relógio? Eu tava com ele agora há pouco.",sad,4
GPT_005_PT,young,male,Fluminense,SL39_8,GPT_005_PT_SL39_8.wav,2.7834375,"Poxa, saíram e me deixaram de lado?",sad,4
GPT_005_PT,young,male,Fluminense,SL45_9,GPT_005_PT_SL45_9.wav,3.805125,Sério que você me traiu e achou que eu não ia descobrir?,angry,5
GPT_005_PT,young,male,Fluminense,SL6_2,GPT_005_PT_SL6_2.wav,3.4335625,Sério que me cortaram depois de ralar tanto?,sad,4
GPT_005_PT,young,male,Fluminense,SL7_3,GPT_005_PT_SL7_3.wav,2.5048125,"Pô, minha comida foi toda pro chão.",angry,4
GPT_006_PT,young,male,Paulista,AH20_8,GPT_006_PT_AH20_8.wav,2.2725625,"Putz, bem agora você resolve parar?",angry,4
GPT_006_PT,young,male,Paulista,AH20_9,GPT_006_PT_AH20_9.wav,2.2725625,Não viu o carro do lado? Bateu em mim!,angry,4
GPT_006_PT,young,male,Paulista,AH23_10,GPT_006_PT_AH23_10.wav,3.5729375,Sério que você me enganou? Pra quê isso justo comigo?,angry,4
GPT_006_PT,young,male,Paulista,AH23_11,GPT_006_PT_AH23_11.wav,2.829875,"Ah, beleza, então minha opinião não conta?",angry,4
GPT_006_PT,young,male,Paulista,AH26_12,GPT_006_PT_AH26_12.wav,3.29425,"Peraí, você tá me culpando sem prova? Eu não fiz isso.",angry,4
GPT_006_PT,young,male,Paulista,AH33_13,GPT_006_PT_AH33_13.wav,3.619375,"Assim não dá; volta pro argumento, não pro drama.",angry,4
GPT_006_PT,young,male,Paulista,AH41_14,GPT_006_PT_AH41_14.wav,3.619375,"Ei, pega leve, tá? Dá pra falar sem ser grosso.",angry,3
GPT_006_PT,young,male,Paulista,AH44_15,GPT_006_PT_AH44_15.wav,4.3159375,"Ô, vizinho, baixa o som, por favor? Tô tentando dormir.",angry,3
GPT_006_PT,young,male,Paulista,AL0_1,GPT_006_PT_AL0_1.wav,4.5016875,"Solta esse fio agora, vai levar choque! Vem cá, pega o brinquedo.",angry,4
GPT_006_PT,young,male,Paulista,AL17_5,GPT_006_PT_AL17_5.wav,3.0620625,Parou tudo de novo; era pra eu já estar lá.,angry,3
GPT_006_PT,young,male,Paulista,AL17_6,GPT_006_PT_AL17_6.wav,2.829875,"Ô, tem fila, tá? É lá atrás.",angry,4
GPT_006_PT,young,male,Paulista,AL1_2,GPT_006_PT_AL1_2.wav,4.4088125,"Pô, confere isso direito, por favor; tô tendo que refazer tudo aqui.",angry,4
GPT_006_PT,young,male,Paulista,AL1_3,GPT_006_PT_AL1_3.wav,4.2695,Como assim ficou no seu nome? Fui eu que toquei essa entrega.,angry,4
GPT_006_PT,young,male,Paulista,AL42_7,GPT_006_PT_AL42_7.wav,1.4366875,"Pera, eu nem terminei.",angry,3
GPT_006_PT,young,male,Paulista,AL6_4,GPT_006_PT_AL6_4.wav,4.9196875,"Pessoal, para de ir solo sem visão; joga junto, senão a gente toma tudo.",angry,4
GPT_006_PT,young,male,Paulista,JH15_9,GPT_006_PT_JH15_9.wav,3.387125,Nasceu! Olha o tamanhinho dessas mãos.,happy,5
GPT_006_PT,young,male,Paulista,JH16_10,GPT_006_PT_JH16_10.wav,3.5729375,Que sossego; dá pra ouvir os passarinhos lá no fundo.,happy,2
GPT_006_PT,young,male,Paulista,JH16_11,GPT_006_PT_JH16_11.wav,4.8268125,"Nossa, cada esquina tem uma surpresa. Bora dar mais uma volta antes de escurecer?",happy,4
GPT_006_PT,young,male,Paulista,JH29_12,GPT_006_PT_JH29_12.wav,2.92275,Disse sim; agora é nós dois pra sempre.,happy,5
GPT_006_PT,young,male,Paulista,JH32_13,GPT_006_PT_JH32_13.wav,2.458375,"Demorou, hein? Vem aqui, me abraça.",happy,4
GPT_006_PT,young,male,Paulista,JH42_14,GPT_006_PT_JH42_14.wav,3.015625,Isso ao vivo é outro nível; solta mais uma!,happy,4
GPT_006_PT,young,male,Paulista,JH46_15,GPT_006_PT_JH46_15.wav,3.48,"Nossa, que capricho; era exatamente o que eu queria.",happy,4
GPT_006_PT,young,male,Paulista,JH6_7,GPT_006_PT_JH6_7.wav,2.4119375,Eu ganhei mesmo? Caiu pra mim!,happy,5
GPT_006_PT,young,male,Paulista,JH6_8,GPT_006_PT_JH6_8.wav,2.5976875,"Nossa, que jogo; fechamos bonito!",happy,5
GPT_006_PT,young,male,Paulista,JL0_1,GPT_006_PT_JL0_1.wav,3.387125,"Chegamos, vem conhecer sua casa, pequenininho!",happy,4
GPT_006_PT,young,male,Paulista,JL11_4,GPT_006_PT_JL11_4.wav,1.9939375,"Nossa, fechei a prova!",happy,4
GPT_006_PT,young,male,Paulista,JL20_5,GPT_006_PT_JL20_5.wav,2.92275,É meu de verdade. Bora dar uma volta agora.,happy,5
GPT_006_PT,young,male,Paulista,JL39_6,GPT_006_PT_JL39_6.wav,2.737,Que som bom; vamos lá encontrar a galera.,happy,4
GPT_006_PT,young,male,Paulista,JL7_2,GPT_006_PT_JL7_2.wav,2.7834375,"Nossa, que delícia—vamos marcar a próxima.",happy,3
GPT_006_PT,young,male,Paulista,JL9_3,GPT_006_PT_JL9_3.wav,5.3840625,Lembra da chuva no jogo? A gente voltou encharcado e mesmo assim foi perfeito.,happy,4
GPT_006_PT,young,male,Paulista,NH17_4,GPT_006_PT_NH17_4.wav,14.3005,"Vou de metrô na maior parte da semana. Faço uma baldeação, desço na estação perto do trabalho e caminho uns dez minutos. Quando aperta o horário, chamo um carro por app. Na volta, às vezes pego a bike compartilhada pra desestressar.",neutral,2
GPT_006_PT,young,male,Paulista,NH24_5,GPT_006_PT_NH24_5.wav,14.625625,"Trouxe pão integral, ovos, tomate, requeijão e um café moído na hora. Peguei também iogurte e umas castanhas pra beliscar. O leite tava com preço bom, acabei levando duas caixas. Ah, e lembrei do papel higiênico no final.",neutral,2
GPT_006_PT,young,male,Paulista,NH48_6,GPT_006_PT_NH48_6.wav,19.641125,"Daqui dá pra ver a rua inteira, com os carros parados lá na esquina e o ônibus cortando a avenida. O sol bate de lado nos prédios e deixa as janelas meio douradas. Tem um ipê roxo carregado na calçada, jogando sombra no ponto. No telhado da frente, o gato do vizinho se espreguiça como se fosse dono do quarteirão.",neutral,2
GPT_006_PT,young,male,Paulista,NH6_3,GPT_006_PT_NH6_3.wav,14.6720625,"Desligo o alarme, abro a janela e deixo o sol entrar. Passo um café e preparo um pão na chapa enquanto faço uns alongamentos rápidos. Dou uma olhada na agenda do dia no celular e separo o que vai na mochila. Banho curto, tênis no pé e partiu.",neutral,2
GPT_006_PT,young,male,Paulista,NL1_1,GPT_006_PT_NL1_1.wav,14.0683125,"Segunda tem o stand-up do time às 9 e a revisão da sprint no fim da tarde. Terça e quinta faço aula de inglês à noite. Quarta é o seminário da faculdade e uma 1:1 rápida com meu líder. Domingo cedo, treino de futebol com o pessoal.",neutral,2
GPT_006_PT,young,male,Paulista,NL21_2,GPT_006_PT_NL21_2.wav,15.6473125,"Terminei um estudo sobre reduzir latência em APIs com cache distribuído. Modelei alguns cenários, medi o impacto em cada um e documentei os trade-offs. Também escrevi um passo a passo de implantação com Terraform. Se quiser, te mando o link do repo com os testes.",neutral,2
GPT_006_PT,young,male,Paulista,RH11_11,GPT_006_PT_RH11_11.wav,2.6905625,"Passei? Caramba, achei que tinha rodado.",relieved,4
GPT_006_PT,young,male,Paulista,RH18_12,GPT_006_PT_RH18_12.wav,3.0620625,"É isso: financiamento aprovado, casa vem aí!",happy,5
GPT_006_PT,young,male,Paulista,RH21_13,GPT_006_PT_RH21_13.wav,2.9691875,Fechei antes do prazo; já subi no sistema.,relieved,3
GPT_006_PT,young,male,Paulista,RH25_14,GPT_006_PT_RH25_14.wav,2.2725625,"Ufa, tava no fundo da mochila.",relieved,4
GPT_006_PT,young,male,Paulista,RH2_10,GPT_006_PT_RH2_10.wav,3.3406875,"Nossa, deu negativo! Agora posso respirar.",relieved,5
GPT_006_PT,young,male,Paulista,RH49_15,GPT_006_PT_RH49_15.wav,2.737,"Que bom, a recuperação tá indo direitinho!",relieved,3
GPT_006_PT,young,male,Paulista,RL0_1,GPT_006_PT_RL0_1.wav,3.898,"Nossa, você voltou pra casa! Vem cá, seu fujão.",relieved,4
GPT_006_PT,young,male,Paulista,RL12_6,GPT_006_PT_RL12_6.wav,2.4119375,Chegou a proposta; quando começo?,happy,4
GPT_006_PT,young,male,Paulista,RL17_7,GPT_006_PT_RL17_7.wav,1.7153125,"Ufa, deu tempo de entrar.",relieved,3
GPT_006_PT,young,male,Paulista,RL1_2,GPT_006_PT_RL1_2.wav,4.362375,Tá feito: pedi demissão. Chega de me desgastar por tão pouco.,relieved,4
GPT_006_PT,young,male,Paulista,RL1_3,GPT_006_PT_RL1_3.wav,1.9939375,"Ufa, não vai dar em nada.",relieved,4
GPT_006_PT,young,male,Paulista,RL22_8,GPT_006_PT_RL22_8.wav,3.7586875,"Nossa, caiu essa grana agora? Salvou meu mês.",relieved,4
GPT_006_PT,young,male,Paulista,RL27_9,GPT_006_PT_RL27_9.wav,3.7586875,"Acabou, de verdade. Bora comemorar mais tarde?",happy,3
GPT_006_PT,young,male,Paulista,RL7_4,GPT_006_PT_RL7_4.wav,3.990875,"Nossa, até que enfim em casa. Vou cair no sofá dois minutos.",relieved,3
GPT_006_PT,young,male,Paulista,RL7_5,GPT_006_PT_RL7_5.wav,2.13325,"Ufa, era só um pesadelo.",relieved,4
GPT_006_PT,young,male,Paulista,SH0_10,GPT_006_PT_SH0_10.wav,3.805125,"Ah, não... meu parceiro de infância se foi.",sad,5
GPT_006_PT,young,male,Paulista,SH19_12,GPT_006_PT_SH19_12.wav,2.829875,Então é isso? Você tá terminando comigo agora?,sad,4
GPT_006_PT,young,male,Paulista,SH28_13,GPT_006_PT_SH28_13.wav,4.362375,"Putz, você está muito mal; vou ficar aqui com você e já chamo ajuda.",angry,4
GPT_006_PT,young,male,Paulista,SH31_14,GPT_006_PT_SH31_14.wav,3.2478125,"Pô, logo agora? Tava contando com esse rolê.",sad,3
GPT_006_PT,young,male,Paulista,SH35_15,GPT_006_PT_SH35_15.wav,4.0373125,"Agora vai ser tudo por chamada e visita só de vez em quando, né?",sad,3
GPT_006_PT,young,male,Paulista,SH9_11,GPT_006_PT_SH9_11.wav,2.3655,"Não é possível, diz que é engano.",sad,5
GPT_006_PT,young,male,Paulista,SL18_4,GPT_006_PT_SL18_4.wav,3.015625,"Aluguel apertou, hora de empacotar e ir.",sad,3
GPT_006_PT,young,male,Paulista,SL1_1,GPT_006_PT_SL1_1.wav,3.5729375,Sério que vão me demitir agora? Depois de tudo que eu entreguei?,angry,4
GPT_006_PT,young,male,Paulista,SL23_5,GPT_006_PT_SL23_5.wav,3.990875,"Caramba, confiei em você e foi como se eu não tivesse dito nada.",sad,4
GPT_006_PT,young,male,Paulista,SL23_6,GPT_006_PT_SL23_6.wav,2.458375,"Poxa, justo você me deixar na mão?",sad,4
GPT_006_PT,young,male,Paulista,SL25_7,GPT_006_PT_SL25_7.wav,3.48,"Ah, não acredito: perdi meus fones preferidos.",sad,4
GPT_006_PT,young,male,Paulista,SL39_8,GPT_006_PT_SL39_8.wav,1.854625,"Poxa, me deixaram de fora?",sad,3
GPT_006_PT,young,male,Paulista,SL45_9,GPT_006_PT_SL45_9.wav,2.2725625,Você achou que eu nunca ia descobrir?,angry,4
GPT_006_PT,young,male,Paulista,SL6_2,GPT_006_PT_SL6_2.wav,3.6658125,Como assim eu tô cortado? Eu ralei tanto por essa vaga.,angry,4
GPT_006_PT,young,male,Paulista,SL7_3,GPT_006_PT_SL7_3.wav,3.898,"Ah, não... derrubei a comida inteira no chão. Logo agora.",angry,4
GPT_007_PT,young,male,Sulista,AH20_8,GPT_007_PT_AH20_8.wav,2.9691875,"Putz, o carro morreu bem no meio da rua.",angry,4
GPT_007_PT,young,male,Sulista,AH20_9,GPT_007_PT_AH20_9.wav,2.8763125,"Ei, olha por onde vai, você bateu em mim!",angry,4
GPT_007_PT,young,male,Sulista,AH23_10,GPT_007_PT_AH23_10.wav,4.0373125,Sério que tu mentiu pra mim? Achei que dava pra contar contigo.,sad,4
GPT_007_PT,young,male,Sulista,AH23_11,GPT_007_PT_AH23_11.wav,4.0373125,"Tá, alguém vai levar em conta o que eu falei ou é só pra constar?",angry,4
GPT_007_PT,young,male,Sulista,AH26_12,GPT_007_PT_AH26_12.wav,3.201375,Como assim tão me culpando por isso? Eu nem tava lá.,angry,4
GPT_007_PT,young,male,Sulista,AH33_13,GPT_007_PT_AH33_13.wav,4.641,"Pera, tu tá distorcendo tudo agora; vamos nos ater ao que realmente aconteceu.",angry,4
GPT_007_PT,young,male,Sulista,AH41_14,GPT_007_PT_AH41_14.wav,3.5265,"Opa, não precisa falar desse jeito; pede com jeitinho, tá?",angry,3
GPT_007_PT,young,male,Sulista,AH44_15,GPT_007_PT_AH44_15.wav,3.71225,"Ô vizinho, dá pra baixar o som? Tô tentando dormir.",angry,4
GPT_007_PT,young,male,Sulista,AL0_1,GPT_007_PT_AL0_1.wav,3.8515625,"Solta esse fio agora, vai roer teu brinquedo!",angry,4
GPT_007_PT,young,male,Sulista,AL17_5,GPT_007_PT_AL17_5.wav,3.387125,"Bah, empacou tudo; não vou sair daqui tão cedo.",angry,3
GPT_007_PT,young,male,Sulista,AL17_6,GPT_007_PT_AL17_6.wav,2.13325,Sério que tu vai furar a fila?,angry,4
GPT_007_PT,young,male,Sulista,AL1_2,GPT_007_PT_AL1_2.wav,3.898,"Cara, isso veio todo errado. Confere antes de me mandar.",angry,4
GPT_007_PT,young,male,Sulista,AL1_3,GPT_007_PT_AL1_3.wav,2.92275,Sério que tu apresentou como se fosse teu?,angry,4
GPT_007_PT,young,male,Sulista,AL42_7,GPT_007_PT_AL42_7.wav,2.5976875,"Só um instante, deixa eu concluir.",angry,3
GPT_007_PT,young,male,Sulista,AL6_4,GPT_007_PT_AL6_4.wav,3.8515625,"Gente, fecha posição e joga junto, senão não tem como virar!",angry,4
GPT_007_PT,young,male,Sulista,JH15_9,GPT_007_PT_JH15_9.wav,3.015625,"Chegou, meu amor! Bem-vindo ao mundo.",happy,5
GPT_007_PT,young,male,Sulista,JH16_10,GPT_007_PT_JH16_10.wav,4.362375,Escuta isso: só o vento nas árvores e um riacho lá no fundo.,neutral,2
GPT_007_PT,young,male,Sulista,JH16_11,GPT_007_PT_JH16_11.wav,4.2695,Que baita lugar; mal pisei e já quero me perder por aqui.,happy,4
GPT_007_PT,young,male,Sulista,JH29_12,GPT_007_PT_JH29_12.wav,2.5976875,A gente disse sim; bora começar.,happy,4
GPT_007_PT,young,male,Sulista,JH32_13,GPT_007_PT_JH32_13.wav,1.5295625,"Até que enfim, vem cá.",relieved,4
GPT_007_PT,young,male,Sulista,JH42_14,GPT_007_PT_JH42_14.wav,3.29425,"Olha isso ao vivo, que solo!",happy,5
GPT_007_PT,young,male,Sulista,JH46_15,GPT_007_PT_JH46_15.wav,5.24475,"Nossa, que cuidado nesse presente; tu me conhece mesmo, valeu demais!",happy,4
GPT_007_PT,young,male,Sulista,JH6_7,GPT_007_PT_JH6_7.wav,4.548125,Meu bilhete foi o sorteado! Bora conferir o valor.,happy,4
GPT_007_PT,young,male,Sulista,JH6_8,GPT_007_PT_JH6_8.wav,3.201375,"É nossa, time! Que jogaço!",happy,5
GPT_007_PT,young,male,Sulista,JL0_1,GPT_007_PT_JL0_1.wav,3.1085,"Vamo entrar, campeão; tua caminha tá te esperando.",happy,4
GPT_007_PT,young,male,Sulista,JL11_4,GPT_007_PT_JL11_4.wav,3.0620625,"Fechei a prova, que baita resultado!",happy,4
GPT_007_PT,young,male,Sulista,JL20_5,GPT_007_PT_JL20_5.wav,2.644125,"Chave na mão, bora dar a primeira volta!",happy,5
GPT_007_PT,young,male,Sulista,JL39_6,GPT_007_PT_JL39_6.wav,3.71225,Já começou do jeito certo; quem puxa a próxima rodada?,happy,4
GPT_007_PT,young,male,Sulista,JL7_2,GPT_007_PT_JL7_2.wav,3.387125,"Que baita comida, gente; já quero marcar a próxima.",happy,4
GPT_007_PT,young,male,Sulista,JL9_3,GPT_007_PT_JL9_3.wav,5.523375,Lembra daquela noite de chuva e a rua virando rio? A gente riu até cansar.,happy,3
